"","GO.ID","term","definition","condition.genes_frequency","condition.pvalue","condition.-log10_pvalue","condition.Significant_genes","condition.Significant_genes_symbol"
"149","GO:0048856","anatomical structure development","The biological process whose specific outcome is the progression of an anatomical structure from an initial condition to its mature state. This process begins with the formation of the structure and ends with the mature structure, whatever form that may be including its natural destruction. An anatomical structure is any biological entity that occupies space and is distinguished from its surroundings. Anatomical structures can be macroscopic such as a carpel, or microscopic such as an acrosome.","0.652% (36/5518)",5.088563e-08,7.29,"ENSG00000018189;ENSG00000033327;ENSG00000038427;ENSG00000067715;ENSG00000078114;ENSG00000078687;ENSG00000100354;ENSG00000101282;ENSG00000102531;ENSG00000103449;ENSG00000105894;ENSG00000111962;ENSG00000112320;ENSG00000114126;ENSG00000120549;ENSG00000134775;ENSG00000138735;ENSG00000138829;ENSG00000140945;ENSG00000141905;ENSG00000144619;ENSG00000146555;ENSG00000148737;ENSG00000150593;ENSG00000163539;ENSG00000165323;ENSG00000170776;ENSG00000170962;ENSG00000179915;ENSG00000180357;ENSG00000182168;ENSG00000182197;ENSG00000185737;ENSG00000185920;ENSG00000187323;ENSG00000257923","RUFY3;GAB2;VCAN;SYT1;NEBL;TNRC6C;TNRC6B;RSPO4;FNDC3A;SALL1;PTN;UST;SOBP;TFDP2;KIAA1217;FHOD3;PDE5A;FBN2;CDH13;NFIC;CNTN4;SDK1;TCF7L2;PDCD4;CLASP2;FAT3;AKAP13;PDGFD;NRXN1;ZNF609;UNC5C;EXT1;NRG3;PTCH1;DCC;CUX1"
"150","GO:0048858","cell projection morphogenesis","The process in which the anatomical structures of a cell projection are generated and organized.","1.935% (13/672)",1.004089e-07,7,"ENSG00000018189;ENSG00000033327;ENSG00000067715;ENSG00000105894;ENSG00000111962;ENSG00000144619;ENSG00000163539;ENSG00000179915;ENSG00000182168;ENSG00000182197;ENSG00000185920;ENSG00000187323;ENSG00000257923","RUFY3;GAB2;SYT1;PTN;UST;CNTN4;CLASP2;NRXN1;UNC5C;EXT1;PTCH1;DCC;CUX1"
"151","GO:0048869","cellular developmental process","A biological process whose specific outcome is the progression of a cell over time from an initial condition to a later condition.","0.735% (29/3943)",4.666514e-07,6.33,"ENSG00000018189;ENSG00000033327;ENSG00000038427;ENSG00000067715;ENSG00000078114;ENSG00000078687;ENSG00000100354;ENSG00000102531;ENSG00000103449;ENSG00000105894;ENSG00000111962;ENSG00000134775;ENSG00000138735;ENSG00000138829;ENSG00000144619;ENSG00000146555;ENSG00000148737;ENSG00000150593;ENSG00000163539;ENSG00000170776;ENSG00000174332;ENSG00000179915;ENSG00000180357;ENSG00000182168;ENSG00000182197;ENSG00000185737;ENSG00000185920;ENSG00000187323;ENSG00000257923","RUFY3;GAB2;VCAN;SYT1;NEBL;TNRC6C;TNRC6B;FNDC3A;SALL1;PTN;UST;FHOD3;PDE5A;FBN2;CNTN4;SDK1;TCF7L2;PDCD4;CLASP2;AKAP13;GLIS1;NRXN1;ZNF609;UNC5C;EXT1;NRG3;PTCH1;DCC;CUX1"
"152","GO:0048870","cell motility","Any process involved in the controlled self-propelled movement of a cell that results in translocation of the cell from one place to another.","0.705% (11/1560)",0.008101456,2.09,"ENSG00000018189;ENSG00000038427;ENSG00000105894;ENSG00000140945;ENSG00000163539;ENSG00000170962;ENSG00000180357;ENSG00000182168;ENSG00000182197;ENSG00000185737;ENSG00000187323","RUFY3;VCAN;PTN;CDH13;CLASP2;PDGFD;ZNF609;UNC5C;EXT1;NRG3;DCC"
"153","GO:0050651","dermatan sulfate proteoglycan biosynthetic process","The chemical reactions and pathways resulting in the formation of dermatan sulfate proteoglycan, any glycoprotein whose glycosaminoglycan units are dermatan sulfate (chondroitin sulfate B). Dermatan sulfate is a glycosaminoglycan with repeats consisting of beta-(1,4)-linked L-iduronyl-beta-(1,3)-N-acetyl-D-galactosamine 4-sulfate units.","13.333% (2/15)",0.0009973783,3,"ENSG00000038427;ENSG00000111962","VCAN;UST"
"154","GO:0050655","dermatan sulfate proteoglycan metabolic process","The chemical reactions and pathways involving dermatan sulfate proteoglycan, any glycoprotein whose glycosaminoglycan units are dermatan sulfate (chondroitin sulfate B). Dermatan sulfate is a glycosaminoglycan with repeats consisting of beta-(1,4)-linked L-iduronyl-beta-(1,3)-N-acetyl-D-galactosamine 4-sulfate units.","12.5% (2/16)",0.001137569,2.94,"ENSG00000038427;ENSG00000111962","VCAN;UST"
"155","GO:0050773","regulation of dendrite development","Any process that modulates the frequency, rate or extent of dendrite development.","2.913% (3/103)",0.004181233,2.38,"ENSG00000105894;ENSG00000187323;ENSG00000257923","PTN;DCC;CUX1"
"156","GO:0050793","regulation of developmental process","Any process that modulates the frequency, rate or extent of development, the biological process whose specific outcome is the progression of a multicellular organism over time from an initial condition (e.g. a zygote, or a young adult) to a later condition (e.g. a multicellular animal or an aged adult).","0.761% (18/2366)",0.0001766195,3.75,"ENSG00000018189;ENSG00000067715;ENSG00000078687;ENSG00000100354;ENSG00000105894;ENSG00000111962;ENSG00000138735;ENSG00000138829;ENSG00000144619;ENSG00000146555;ENSG00000148737;ENSG00000150593;ENSG00000163539;ENSG00000174332;ENSG00000179915;ENSG00000185920;ENSG00000187323;ENSG00000257923","RUFY3;SYT1;TNRC6C;TNRC6B;PTN;UST;PDE5A;FBN2;CNTN4;SDK1;TCF7L2;PDCD4;CLASP2;GLIS1;NRXN1;PTCH1;DCC;CUX1"
"157","GO:0050804","modulation of chemical synaptic transmission","Any process that modulates the frequency or amplitude of synaptic transmission, the process of communication from a neuron to a target (neuron, muscle, or secretory cell) across a synapse.  Amplitude, in this case, refers to the change in postsynaptic membrane potential due to a single instance of synaptic transmission.","1.882% (8/425)",4.921654e-05,4.31,"ENSG00000067715;ENSG00000105894;ENSG00000144619;ENSG00000165995;ENSG00000179915;ENSG00000185737;ENSG00000187323;ENSG00000196277","SYT1;PTN;CNTN4;CACNB2;NRXN1;NRG3;DCC;GRM7"
"158","GO:0050806","positive regulation of synaptic transmission","Any process that activates or increases the frequency, rate or extent of synaptic transmission, the process of communication from a neuron to a target (neuron, muscle, or secretory cell) across a synapse.","2.721% (4/147)",0.001171066,2.93,"ENSG00000067715;ENSG00000105894;ENSG00000165995;ENSG00000179915","SYT1;PTN;CACNB2;NRXN1"
"159","GO:0050919","negative chemotaxis","The directed movement of a motile cell or organism towards a lower concentration of a chemical.","4.348% (2/46)",0.009238337,2.03,"ENSG00000182168;ENSG00000185737","UNC5C;NRG3"
"160","GO:0050921","positive regulation of chemotaxis","Any process that activates or increases the frequency, rate or extent of the directed movement of a motile cell or organism in response to a specific chemical concentration gradient.","2.4% (3/125)",0.007158037,2.15,"ENSG00000105894;ENSG00000140945;ENSG00000170962","PTN;CDH13;PDGFD"
"161","GO:0051047","positive regulation of secretion","Any process that activates or increases the frequency, rate or extent of the controlled release of a substance from a cell or a tissue.","1.706% (5/293)",0.002228887,2.65,"ENSG00000033327;ENSG00000067715;ENSG00000148737;ENSG00000163539;ENSG00000165995","GAB2;SYT1;TCF7L2;CLASP2;CACNB2"
"162","GO:0051049","regulation of transport","Any process that modulates the frequency, rate or extent of the directed movement of substances (such as macromolecules, small molecules, ions) into, out of or within a cell, or between cells, by means of some agent such as a transporter or pore.","0.845% (14/1656)",0.0004198499,3.38,"ENSG00000018189;ENSG00000033327;ENSG00000067715;ENSG00000082898;ENSG00000114126;ENSG00000115977;ENSG00000140945;ENSG00000148737;ENSG00000163539;ENSG00000165995;ENSG00000179915;ENSG00000185920;ENSG00000196277;ENSG00000198911","RUFY3;GAB2;SYT1;XPO1;TFDP2;AAK1;CDH13;TCF7L2;CLASP2;CACNB2;NRXN1;PTCH1;GRM7;SREBF2"
"163","GO:0051050","positive regulation of transport","Any process that activates or increases the frequency, rate or extent of the directed movement of substances (such as macromolecules, small molecules, ions) into, out of or within a cell, or between cells, by means of some agent such as a transporter or pore.","1.055% (9/853)",0.001222029,2.91,"ENSG00000018189;ENSG00000033327;ENSG00000067715;ENSG00000114126;ENSG00000148737;ENSG00000163539;ENSG00000165995;ENSG00000185920;ENSG00000198911","RUFY3;GAB2;SYT1;TFDP2;TCF7L2;CLASP2;CACNB2;PTCH1;SREBF2"
"164","GO:0051094","positive regulation of developmental process","Any process that activates or increases the rate or extent of development, the biological process whose specific outcome is the progression of an organism over time from an initial condition (e.g. a zygote, or a young adult) to a later condition (e.g. a multicellular animal or an aged adult).","0.817% (10/1224)",0.004263003,2.37,"ENSG00000018189;ENSG00000067715;ENSG00000105894;ENSG00000138735;ENSG00000138829;ENSG00000148737;ENSG00000163539;ENSG00000179915;ENSG00000185920;ENSG00000257923","RUFY3;SYT1;PTN;PDE5A;FBN2;TCF7L2;CLASP2;NRXN1;PTCH1;CUX1"
"165","GO:0051128","regulation of cellular component organization","Any process that modulates the frequency, rate or extent of a process involved in the formation, arrangement of constituent parts, or disassembly of cell structures, including the plasma membrane and any external encapsulating structures such as the cell wall and cell envelope.","0.743% (17/2288)",0.0003880819,3.41,"ENSG00000018189;ENSG00000054523;ENSG00000067715;ENSG00000082898;ENSG00000105894;ENSG00000111962;ENSG00000114126;ENSG00000115977;ENSG00000134775;ENSG00000140945;ENSG00000163539;ENSG00000170776;ENSG00000179915;ENSG00000185737;ENSG00000187323;ENSG00000198911;ENSG00000257923","RUFY3;KIF1B;SYT1;XPO1;PTN;UST;TFDP2;AAK1;FHOD3;CDH13;CLASP2;AKAP13;NRXN1;NRG3;DCC;SREBF2;CUX1"
"166","GO:0051172","negative regulation of nitrogen compound metabolic process","Any process that stops, prevents, or reduces the frequency, rate or extent of the chemical reactions and pathways involving nitrogen or nitrogenous compounds.","0.613% (14/2285)",0.009065737,2.04,"ENSG00000078687;ENSG00000082898;ENSG00000100354;ENSG00000103449;ENSG00000105894;ENSG00000114126;ENSG00000125740;ENSG00000141905;ENSG00000148737;ENSG00000150593;ENSG00000174332;ENSG00000185920;ENSG00000198911;ENSG00000257923","TNRC6C;XPO1;TNRC6B;SALL1;PTN;TFDP2;FOSB;NFIC;TCF7L2;PDCD4;GLIS1;PTCH1;SREBF2;CUX1"
"167","GO:0051173","positive regulation of nitrogen compound metabolic process","Any process that activates or increases the frequency, rate or extent of the chemical reactions and pathways involving nitrogen or nitrogenous compounds.","0.585% (17/2904)",0.005717483,2.24,"ENSG00000078687;ENSG00000100354;ENSG00000103449;ENSG00000114126;ENSG00000125740;ENSG00000138735;ENSG00000140945;ENSG00000141905;ENSG00000148737;ENSG00000170776;ENSG00000170962;ENSG00000174332;ENSG00000179915;ENSG00000180357;ENSG00000185737;ENSG00000185920;ENSG00000198911","TNRC6C;TNRC6B;SALL1;TFDP2;FOSB;PDE5A;CDH13;NFIC;TCF7L2;AKAP13;PDGFD;GLIS1;NRXN1;ZNF609;NRG3;PTCH1;SREBF2"
"168","GO:0051253","negative regulation of RNA metabolic process","Any process that stops, prevents, or reduces the frequency, rate or extent of the chemical reactions and pathways involving RNA.","0.794% (11/1386)",0.003315627,2.48,"ENSG00000082898;ENSG00000103449;ENSG00000114126;ENSG00000125740;ENSG00000141905;ENSG00000148737;ENSG00000150593;ENSG00000174332;ENSG00000185920;ENSG00000198911;ENSG00000257923","XPO1;SALL1;TFDP2;FOSB;NFIC;TCF7L2;PDCD4;GLIS1;PTCH1;SREBF2;CUX1"
"169","GO:0051254","positive regulation of RNA metabolic process","Any process that activates or increases the frequency, rate or extent of the chemical reactions and pathways involving RNA.","0.729% (12/1645)",0.004207303,2.38,"ENSG00000078687;ENSG00000100354;ENSG00000103449;ENSG00000114126;ENSG00000125740;ENSG00000140945;ENSG00000141905;ENSG00000148737;ENSG00000174332;ENSG00000180357;ENSG00000185920;ENSG00000198911","TNRC6C;TNRC6B;SALL1;TFDP2;FOSB;CDH13;NFIC;TCF7L2;GLIS1;ZNF609;PTCH1;SREBF2"
"170","GO:0051272","positive regulation of cellular component movement","Any process that activates or increases the frequency, rate or extent of the movement of a cellular component.","1.095% (6/548)",0.007225315,2.14,"ENSG00000018189;ENSG00000105894;ENSG00000140945;ENSG00000163539;ENSG00000170962;ENSG00000180357","RUFY3;PTN;CDH13;CLASP2;PDGFD;ZNF609"
"171","GO:0051590","positive regulation of neurotransmitter transport","Any process that activates or increases the frequency, rate or extent of the directed movement of a neurotransmitter into, out of or within a cell, or between cells, by means of some agent such as a transporter or pore.","9.091% (2/22)",0.002163549,2.66,"ENSG00000067715;ENSG00000165995","SYT1;CACNB2"
"172","GO:0051668","localization within membrane","Any process in which a substance or cellular entity, such as a protein complex or organelle, is transported to, and/or maintained in, a specific location within a membrane.","3.704% (3/81)",0.002117317,2.67,"ENSG00000105894;ENSG00000140945;ENSG00000179915","PTN;CDH13;NRXN1"
"173","GO:0051674","localization of cell","Any process in which a cell is transported to, and/or maintained in, a specific location.","0.705% (11/1560)",0.008101456,2.09,"ENSG00000018189;ENSG00000038427;ENSG00000105894;ENSG00000140945;ENSG00000163539;ENSG00000170962;ENSG00000180357;ENSG00000182168;ENSG00000182197;ENSG00000185737;ENSG00000187323","RUFY3;VCAN;PTN;CDH13;CLASP2;PDGFD;ZNF609;UNC5C;EXT1;NRG3;DCC"
"174","GO:0051923","sulfation","The addition of a sulfate group to a molecule.","11.111% (2/18)",0.001444574,2.84,"ENSG00000111962;ENSG00000182197","UST;EXT1"
"175","GO:0051966","regulation of synaptic transmission, glutamatergic","Any process that modulates the frequency, rate or extent of glutamatergic synaptic transmission, the process of communication from a neuron to another neuron across a synapse using the neurotransmitter glutamate.","4.478% (3/67)",0.001226109,2.91,"ENSG00000067715;ENSG00000179915;ENSG00000196277","SYT1;NRXN1;GRM7"
"176","GO:0055002","striated muscle cell development","The process whose specific outcome is the progression of a striated muscle cell over time, from its formation to the mature structure. Striated muscle cells contain fibers that are divided by transverse bands into striations, and cardiac and skeletal muscle are types of striated muscle.","2.778% (3/108)",0.004774022,2.32,"ENSG00000078114;ENSG00000134775;ENSG00000170776","NEBL;FHOD3;AKAP13"
"177","GO:0055003","cardiac myofibril assembly","The process whose specific outcome is the progression of the cardiac myofibril over time, from its formation to the mature structure. A cardiac myofibril is a myofibril specific to cardiac muscle cells.","11.111% (2/18)",0.001444574,2.84,"ENSG00000078114;ENSG00000134775","NEBL;FHOD3"
"178","GO:0055006","cardiac cell development","The process whose specific outcome is the progression of a cardiac cell over time, from its formation to the mature state. A cardiac cell is a cell that will form part of the cardiac organ of an individual.","5.263% (4/76)",9.477996e-05,4.02,"ENSG00000078114;ENSG00000134775;ENSG00000150593;ENSG00000170776","NEBL;FHOD3;PDCD4;AKAP13"
"179","GO:0055007","cardiac muscle cell differentiation","The process in which a cardiac muscle precursor cell acquires specialized features of a cardiac muscle cell. Cardiac muscle cells are striated muscle cells that are responsible for heart contraction.","2.885% (3/104)",0.004295969,2.37,"ENSG00000078114;ENSG00000134775;ENSG00000170776","NEBL;FHOD3;AKAP13"
"180","GO:0055013","cardiac muscle cell development","The process whose specific outcome is the progression of a cardiac muscle cell over time, from its formation to the mature state.","4.286% (3/70)",0.001391801,2.86,"ENSG00000078114;ENSG00000134775;ENSG00000170776","NEBL;FHOD3;AKAP13"
"181","GO:0055094","response to lipoprotein particle","Any process that results in a change in state or activity of a cell or an organism (in terms of movement, secretion, enzyme production, gene expression, etc.) as a result of a lipoprotein particle stimulus.","7.143% (2/28)",0.003497932,2.46,"ENSG00000140945;ENSG00000198911","CDH13;SREBF2"
"182","GO:0060173","limb development","The process whose specific outcome is the progression of a limb over time, from its formation to the mature structure. A limb is an appendage of an animal used for locomotion or grasping. Examples include legs, arms or some types of fin.","2.809% (5/178)",0.0002363306,3.63,"ENSG00000101282;ENSG00000103449;ENSG00000138829;ENSG00000182197;ENSG00000185920","RSPO4;SALL1;FBN2;EXT1;PTCH1"
"183","GO:0060211","regulation of nuclear-transcribed mRNA poly(A) tail shortening","Any process that modulates the frequency, rate or extent of poly(A) tail shortening of a nuclear-transcribed mRNA. Poly(A) tail shortening is the decrease in length of the poly(A) tail of an mRNA from full length to an oligo(A) length.","13.333% (2/15)",0.0009973783,3,"ENSG00000078687;ENSG00000100354","TNRC6C;TNRC6B"
"184","GO:0060213","positive regulation of nuclear-transcribed mRNA poly(A) tail shortening","Any process that increases the frequency, rate or extent of poly(A) tail shortening of a nuclear-transcribed mRNA. Poly(A) tail shortening is the decrease in length of the poly(A) tail of an mRNA from full length to an oligo(A) length.","15.385% (2/13)",0.0007438995,3.13,"ENSG00000078687;ENSG00000100354","TNRC6C;TNRC6B"
"185","GO:0060322","head development","The biological process whose specific outcome is the progression of a head from an initial condition to its mature state. The head is the anterior-most division of the body.","1.138% (9/791)",0.0007153728,3.15,"ENSG00000067715;ENSG00000103449;ENSG00000105894;ENSG00000144619;ENSG00000179915;ENSG00000182168;ENSG00000182197;ENSG00000185737;ENSG00000185920","SYT1;SALL1;PTN;CNTN4;NRXN1;UNC5C;EXT1;NRG3;PTCH1"
"186","GO:0060341","regulation of cellular localization","Any process that modulates the frequency, rate or extent of a process in which a cell, a substance, or a cellular entity is transported to, or maintained in a specific location within or in the membrane of a cell.","0.976% (8/820)",0.003816459,2.42,"ENSG00000018189;ENSG00000033327;ENSG00000082898;ENSG00000105894;ENSG00000114126;ENSG00000148737;ENSG00000179915;ENSG00000198911","RUFY3;GAB2;XPO1;PTN;TFDP2;TCF7L2;NRXN1;SREBF2"
"187","GO:0060443","mammary gland morphogenesis","The process in which anatomical structures of the mammary gland are generated and organized. Morphogenesis refers to the creation of shape. The mammary gland is a large compound sebaceous gland that in female mammals is modified to secrete milk.","4.255% (2/47)",0.009629651,2.02,"ENSG00000185737;ENSG00000185920","NRG3;PTCH1"
"188","GO:0060560","developmental growth involved in morphogenesis","The increase in size or mass of an anatomical structure that contributes to the structure attaining its shape.","2.51% (6/239)",9.983301e-05,4,"ENSG00000018189;ENSG00000067715;ENSG00000103449;ENSG00000163539;ENSG00000182197;ENSG00000187323","RUFY3;SYT1;SALL1;CLASP2;EXT1;DCC"
"189","GO:0060627","regulation of vesicle-mediated transport","Any process that modulates the rate, frequency, or extent of vesicle-mediated transport, the directed movement of substances, either within a vesicle or in the vesicle membrane, into, out of or within a cell.","1.367% (7/512)",0.001045193,2.98,"ENSG00000033327;ENSG00000067715;ENSG00000115977;ENSG00000140945;ENSG00000163539;ENSG00000165995;ENSG00000179915","GAB2;SYT1;AAK1;CDH13;CLASP2;CACNB2;NRXN1"
"190","GO:0061005","cell differentiation involved in kidney development","The process in which relatively unspecialized cells acquire specialized structural and/or functional features that characterize the cells of the kidney as it progresses from its formation to the mature state.","5.357% (3/56)",0.0007269328,3.14,"ENSG00000103449;ENSG00000182197;ENSG00000185920","SALL1;EXT1;PTCH1"
"191","GO:0061387","regulation of extent of cell growth","Any process that modulates the extent of cell growth.","2.679% (3/112)",0.005283077,2.28,"ENSG00000018189;ENSG00000163539;ENSG00000187323","RUFY3;CLASP2;DCC"
"192","GO:0061564","axon development","The progression of an axon over time. Covers axonogenesis (de novo generation of an axon) and axon regeneration (regrowth), as well as processes pertaining to the progression of the axon over time (fasciculation and defasciculation).","2.148% (11/512)",4.124576e-07,6.38,"ENSG00000018189;ENSG00000033327;ENSG00000105894;ENSG00000111962;ENSG00000144619;ENSG00000163539;ENSG00000179915;ENSG00000182168;ENSG00000182197;ENSG00000185920;ENSG00000187323","RUFY3;GAB2;PTN;UST;CNTN4;CLASP2;NRXN1;UNC5C;EXT1;PTCH1;DCC"
"193","GO:0070169","positive regulation of biomineral tissue development","Any process that activates or increases the frequency, rate or extent of biomineral tissue development, the formation of hard tissues that consist mainly of inorganic compounds.","4.348% (2/46)",0.009238337,2.03,"ENSG00000105894;ENSG00000138829","PTN;FBN2"
"194","GO:0070593","dendrite self-avoidance","The process in which dendrites recognize and avoid contact with sister dendrites from the same cell.","11.765% (2/17)",0.001286652,2.89,"ENSG00000144619;ENSG00000182197","CNTN4;EXT1"
"195","GO:0070848","response to growth factor","Any process that results in a change in state or activity of a cell or an organism (in terms of movement, secretion, enzyme production, gene expression, etc.) as a result of a growth factor stimulus.","0.983% (7/712)",0.006604398,2.18,"ENSG00000054523;ENSG00000105894;ENSG00000138829;ENSG00000150593;ENSG00000170962;ENSG00000179915;ENSG00000182197","KIF1B;PTN;FBN2;PDCD4;PDGFD;NRXN1;EXT1"
"196","GO:0071277","cellular response to calcium ion","Any process that results in a change in state or activity of a cell (in terms of movement, secretion, enzyme production, gene expression, etc.) as a result of a calcium ion stimulus.","3.75% (3/80)",0.002043398,2.69,"ENSG00000067715;ENSG00000125740;ENSG00000179915","SYT1;FOSB;NRXN1"
"197","GO:0071363","cellular response to growth factor stimulus","Any process that results in a change in state or activity of a cell (in terms of movement, secretion, enzyme production, gene expression, etc.) as a result of a growth factor stimulus.","1.022% (7/685)",0.005367069,2.27,"ENSG00000054523;ENSG00000105894;ENSG00000138829;ENSG00000150593;ENSG00000170962;ENSG00000179915;ENSG00000182197","KIF1B;PTN;FBN2;PDCD4;PDGFD;NRXN1;EXT1"
"198","GO:0071402","cellular response to lipoprotein particle stimulus","Any process that results in a change in state or activity of a cell (in terms of movement, secretion, enzyme production, gene expression, etc.) as a result of a lipoprotein particle stimulus.","6.667% (2/30)",0.004009269,2.4,"ENSG00000140945;ENSG00000198911","CDH13;SREBF2"
"199","GO:0071404","cellular response to low-density lipoprotein particle stimulus","Any process that results in a change in state or activity of a cell (in terms of movement, secretion, enzyme production, gene expression, etc.) as a result of a low-density lipoprotein particle stimulus.","11.111% (2/18)",0.001444574,2.84,"ENSG00000140945;ENSG00000198911","CDH13;SREBF2"
"200","GO:0071625","vocalization behavior","The behavior in which an organism produces sounds by a mechanism involving its respiratory system.","11.111% (2/18)",0.001444574,2.84,"ENSG00000179915;ENSG00000182197","NRXN1;EXT1"
"201","GO:0071711","basement membrane organization","A process that is carried out at the cellular level which results in the assembly, arrangement of constituent parts, or disassembly of the basement membrane.","6.452% (2/31)",0.004277178,2.37,"ENSG00000163539;ENSG00000182197","CLASP2;EXT1"
"202","GO:0072006","nephron development","The process whose specific outcome is the progression of the nephron over time, from its formation to the mature structure. A nephron is the functional unit of the kidney.","2.878% (4/139)",0.0009513344,3.02,"ENSG00000103449;ENSG00000170962;ENSG00000182197;ENSG00000185920","SALL1;PDGFD;EXT1;PTCH1"
"203","GO:0072009","nephron epithelium development","The process whose specific outcome is the progression of the nephron epithelium over time, from its formation to the mature structure. An epithelium is a tissue that covers the internal or external surfaces of an anatomical structure. The nephron epithelium is a tissue that covers the surface of a nephron.","2.778% (3/108)",0.004774022,2.32,"ENSG00000103449;ENSG00000182197;ENSG00000185920","SALL1;EXT1;PTCH1"
"204","GO:0072073","kidney epithelium development","The process whose specific outcome is the progression of an epithelium in the kidney over time, from its formation to the mature structure. An epithelium is a tissue that covers the internal or external surfaces of an anatomical structure.","2.158% (3/139)",0.009568453,2.02,"ENSG00000103449;ENSG00000182197;ENSG00000185920","SALL1;EXT1;PTCH1"
"205","GO:0072111","cell proliferation involved in kidney development","The multiplication or reproduction of cells, resulting in the expansion of the population in the kidney.","10.526% (2/19)",0.001611279,2.79,"ENSG00000170962;ENSG00000185920","PDGFD;PTCH1"
"206","GO:0072359","circulatory system development","The process whose specific outcome is the progression of the circulatory system over time, from its formation to the mature structure. The circulatory system is the organ system that passes nutrients (such as amino acids and electrolytes), gases, hormones, blood cells, etc. to and from cells in the body to help fight diseases and help stabilize body temperature and pH to maintain homeostasis.","1.215% (13/1070)",1.823251e-05,4.74,"ENSG00000078114;ENSG00000103449;ENSG00000105894;ENSG00000114126;ENSG00000134775;ENSG00000140945;ENSG00000148737;ENSG00000150593;ENSG00000170776;ENSG00000170962;ENSG00000179915;ENSG00000182197;ENSG00000185920","NEBL;SALL1;PTN;TFDP2;FHOD3;CDH13;TCF7L2;PDCD4;AKAP13;PDGFD;NRXN1;EXT1;PTCH1"
