"","GO.ID","term","definition","condition.genes_frequency","condition.pvalue","condition.-log10_pvalue","condition.Significant_genes","condition.Significant_genes_symbol"
"102","GO:0035249","synaptic transmission, glutamatergic","The vesicular release of glutamate from a presynapse, across a chemical synapse, the subsequent activation of glutamate receptors at the postsynapse of a target cell (neuron, muscle, or secretory cell) and the effects of this activation on the postsynaptic membrane potential and ionic composition of the postsynaptic cytosol. This process encompasses both spontaneous and evoked release of neurotransmitter and all parts of synaptic vesicle exocytosis. Evoked transmission starts with the arrival of an action potential at the presynapse.","4.348% (4/92)",0.0001989313,3.7,"ENSG00000067715;ENSG00000179915;ENSG00000182197;ENSG00000196277","SYT1;NRXN1;EXT1;GRM7"
"103","GO:0035278","miRNA mediated inhibition of translation","The process in which microRNAs (miRNAs) block the translation of target mRNAs into proteins. Once incorporated into a RNA-induced silencing complex (RISC), a miRNA will typically mediate repression of translation if the miRNA imperfectly base-pairs with the 3' untranslated regions of target mRNAs.","4.545% (2/44)",0.008477783,2.07,"ENSG00000078687;ENSG00000100354","TNRC6C;TNRC6B"
"104","GO:0035850","epithelial cell differentiation involved in kidney development","The process in which relatively unspecialized cells acquire specialized structural and/or functional features of an epithelial cell that characterize the cells of the kidney as it progresses from its formation to the mature state.","4.348% (2/46)",0.009238337,2.03,"ENSG00000103449;ENSG00000182197","SALL1;EXT1"
"105","GO:0036119","response to platelet-derived growth factor","Any process that results in a change in state or activity of a cell or an organism (in terms of movement, secretion, enzyme production, gene expression, etc.) as a result of a platelet-derived growth factor stimulus.","9.091% (2/22)",0.002163549,2.66,"ENSG00000105894;ENSG00000170962","PTN;PDGFD"
"106","GO:0036120","cellular response to platelet-derived growth factor stimulus","Any process that results in a change in state or activity of a cell (in terms of movement, secretion, enzyme production, gene expression, etc.) as a result of a platelet-derived growth factor stimulus.","9.524% (2/21)",0.001970821,2.71,"ENSG00000105894;ENSG00000170962","PTN;PDGFD"
"107","GO:0038007","netrin-activated signaling pathway","A series of molecular events initiated by the binding of a netrin protein to a receptor on the surface of the target cell, and ending with regulation of a downstream cellular process, e.g. transcription. Netrins can act as chemoattractant signals for some cells and chemorepellent signals for others. Netrins also have roles outside of cell and axon guidance.","15.385% (2/13)",0.0007438995,3.13,"ENSG00000182168;ENSG00000187323","UNC5C;DCC"
"108","GO:0040007","growth","The increase in size or mass of an entire organism, a part of an organism or a cell.","1.065% (10/939)",0.0005840537,3.23,"ENSG00000018189;ENSG00000067715;ENSG00000103449;ENSG00000105894;ENSG00000163539;ENSG00000170776;ENSG00000182197;ENSG00000185737;ENSG00000185920;ENSG00000187323","RUFY3;SYT1;SALL1;PTN;CLASP2;AKAP13;EXT1;NRG3;PTCH1;DCC"
"109","GO:0040011","locomotion","Self-propelled movement of a cell or organism from one location to another.","0.862% (15/1741)",0.0001969813,3.71,"ENSG00000018189;ENSG00000033327;ENSG00000038427;ENSG00000105894;ENSG00000140945;ENSG00000144619;ENSG00000163539;ENSG00000170962;ENSG00000179915;ENSG00000180357;ENSG00000182168;ENSG00000182197;ENSG00000185737;ENSG00000185920;ENSG00000187323","RUFY3;GAB2;VCAN;PTN;CDH13;CNTN4;CLASP2;PDGFD;NRXN1;ZNF609;UNC5C;EXT1;NRG3;PTCH1;DCC"
"110","GO:0040012","regulation of locomotion","Any process that modulates the frequency, rate or extent of locomotion of a cell or organism.","0.831% (8/963)",0.009865715,2.01,"ENSG00000018189;ENSG00000105894;ENSG00000140945;ENSG00000163539;ENSG00000170962;ENSG00000180357;ENSG00000182168;ENSG00000185737","RUFY3;PTN;CDH13;CLASP2;PDGFD;ZNF609;UNC5C;NRG3"
"111","GO:0040017","positive regulation of locomotion","Any process that activates or increases the frequency, rate or extent of locomotion of a cell or organism.","1.095% (6/548)",0.007225315,2.14,"ENSG00000018189;ENSG00000105894;ENSG00000140945;ENSG00000163539;ENSG00000170962;ENSG00000180357","RUFY3;PTN;CDH13;CLASP2;PDGFD;ZNF609"
"112","GO:0040033","negative regulation of translation, ncRNA-mediated","Any process, mediated by small non-coding RNAs, that stops, prevents or reduces the rate that mRNAs are effectively translated into protein.","4.545% (2/44)",0.008477783,2.07,"ENSG00000078687;ENSG00000100354","TNRC6C;TNRC6B"
"113","GO:0042221","response to chemical","Any process that results in a change in state or activity of a cell or an organism (in terms of movement, secretion, enzyme production, gene expression, etc.) as a result of a chemical stimulus.","0.525% (21/4001)",0.006584595,2.18,"ENSG00000033327;ENSG00000054523;ENSG00000067715;ENSG00000082898;ENSG00000105894;ENSG00000125740;ENSG00000138829;ENSG00000140945;ENSG00000144619;ENSG00000146555;ENSG00000148737;ENSG00000150593;ENSG00000170776;ENSG00000170962;ENSG00000179915;ENSG00000182168;ENSG00000182197;ENSG00000185737;ENSG00000185920;ENSG00000187323;ENSG00000198911","GAB2;KIF1B;SYT1;XPO1;PTN;FOSB;FBN2;CDH13;CNTN4;SDK1;TCF7L2;PDCD4;AKAP13;PDGFD;NRXN1;UNC5C;EXT1;NRG3;PTCH1;DCC;SREBF2"
"114","GO:0042330","taxis","The directed movement of a motile cell or organism in response to an external stimulus.","1.877% (11/586)",1.55867e-06,5.81,"ENSG00000033327;ENSG00000105894;ENSG00000140945;ENSG00000144619;ENSG00000170962;ENSG00000179915;ENSG00000182168;ENSG00000182197;ENSG00000185737;ENSG00000185920;ENSG00000187323","GAB2;PTN;CDH13;CNTN4;PDGFD;NRXN1;UNC5C;EXT1;NRG3;PTCH1;DCC"
"115","GO:0043269","regulation of ion transport","Any process that modulates the frequency, rate or extent of the directed movement of charged atoms or small charged molecules into, out of or within a cell, or between cells, by means of some agent such as a transporter or pore.","0.802% (10/1247)",0.004865534,2.31,"ENSG00000018189;ENSG00000067715;ENSG00000082898;ENSG00000114126;ENSG00000148737;ENSG00000165995;ENSG00000179915;ENSG00000185920;ENSG00000196277;ENSG00000198911","RUFY3;SYT1;XPO1;TFDP2;TCF7L2;CACNB2;NRXN1;PTCH1;GRM7;SREBF2"
"116","GO:0043270","positive regulation of ion transport","Any process that activates or increases the frequency, rate or extent of the directed movement of charged atoms or small charged molecules into, out of or within a cell, or between cells, by means of some agent such as a transporter or pore.","1.101% (7/636)",0.003579047,2.45,"ENSG00000018189;ENSG00000067715;ENSG00000114126;ENSG00000148737;ENSG00000165995;ENSG00000185920;ENSG00000198911","RUFY3;SYT1;TFDP2;TCF7L2;CACNB2;PTCH1;SREBF2"
"117","GO:0043616","keratinocyte proliferation","The multiplication or reproduction of keratinocytes, resulting in the expansion of a cell population. Keratinocytes are epidermal cells which synthesize keratin and undergo a characteristic change as they move upward from the basal layers of the epidermis to the cornified (horny) layer of the skin.","4.762% (2/42)",0.007746987,2.11,"ENSG00000140945;ENSG00000185920","CDH13;PTCH1"
"118","GO:0044070","regulation of anion transport","Any process that modulates the frequency, rate or extent of the directed movement of anions, atoms or small molecules with a net negative charge into, out of or within a cell, or between cells, by means of some agent such as a transporter or pore.","0.989% (8/809)",0.003515019,2.45,"ENSG00000018189;ENSG00000067715;ENSG00000082898;ENSG00000114126;ENSG00000148737;ENSG00000185920;ENSG00000196277;ENSG00000198911","RUFY3;SYT1;XPO1;TFDP2;TCF7L2;PTCH1;GRM7;SREBF2"
"119","GO:0045165","cell fate commitment","The commitment of cells to specific cell fates and their capacity to differentiate into particular kinds of cells. Positional information is established through protein signals that emanate from a localized source within a cell (the initial one-cell zygote) or within a developmental field.","1.739% (4/230)",0.005887326,2.23,"ENSG00000148737;ENSG00000174332;ENSG00000182197;ENSG00000185920","TCF7L2;GLIS1;EXT1;PTCH1"
"120","GO:0045214","sarcomere organization","The myofibril assembly process that results in the organization of muscle actomyosin into sarcomeres. The sarcomere is the repeating unit of a myofibril in a muscle cell, composed of an array of overlapping thick and thin filaments between two adjacent Z discs.","5% (2/40)",0.007046338,2.15,"ENSG00000134775;ENSG00000170776","FHOD3;AKAP13"
"121","GO:0045595","regulation of cell differentiation","Any process that modulates the frequency, rate or extent of cell differentiation, the process in which relatively unspecialized cells acquire specialized structural and functional features.","0.931% (14/1504)",0.0001530203,3.82,"ENSG00000018189;ENSG00000078687;ENSG00000100354;ENSG00000105894;ENSG00000138735;ENSG00000138829;ENSG00000144619;ENSG00000148737;ENSG00000150593;ENSG00000163539;ENSG00000174332;ENSG00000185920;ENSG00000187323;ENSG00000257923","RUFY3;TNRC6C;TNRC6B;PTN;PDE5A;FBN2;CNTN4;TCF7L2;PDCD4;CLASP2;GLIS1;PTCH1;DCC;CUX1"
"122","GO:0045596","negative regulation of cell differentiation","Any process that stops, prevents, or reduces the frequency, rate or extent of cell differentiation.","1.149% (7/609)",0.002813062,2.55,"ENSG00000018189;ENSG00000105894;ENSG00000144619;ENSG00000150593;ENSG00000174332;ENSG00000185920;ENSG00000187323","RUFY3;PTN;CNTN4;PDCD4;GLIS1;PTCH1;DCC"
"123","GO:0045892","negative regulation of transcription, DNA-templated","Any process that stops, prevents, or reduces the frequency, rate or extent of cellular DNA-templated transcription.","0.878% (11/1253)",0.001488875,2.83,"ENSG00000082898;ENSG00000103449;ENSG00000114126;ENSG00000125740;ENSG00000141905;ENSG00000148737;ENSG00000150593;ENSG00000174332;ENSG00000185920;ENSG00000198911;ENSG00000257923","XPO1;SALL1;TFDP2;FOSB;NFIC;TCF7L2;PDCD4;GLIS1;PTCH1;SREBF2;CUX1"
"124","GO:0045921","positive regulation of exocytosis","Any process that activates or increases the frequency, rate or extent of exocytosis.","4.706% (4/85)",0.0001465042,3.83,"ENSG00000033327;ENSG00000067715;ENSG00000163539;ENSG00000165995","GAB2;SYT1;CLASP2;CACNB2"
"125","GO:0045934","negative regulation of nucleobase-containing compound metabolic process","Any cellular process that stops, prevents, or reduces the frequency, rate or extent of the chemical reactions and pathways involving nucleobases, nucleosides, nucleotides and nucleic acids.","0.743% (11/1481)",0.005505904,2.26,"ENSG00000082898;ENSG00000103449;ENSG00000114126;ENSG00000125740;ENSG00000141905;ENSG00000148737;ENSG00000150593;ENSG00000174332;ENSG00000185920;ENSG00000198911;ENSG00000257923","XPO1;SALL1;TFDP2;FOSB;NFIC;TCF7L2;PDCD4;GLIS1;PTCH1;SREBF2;CUX1"
"126","GO:0045935","positive regulation of nucleobase-containing compound metabolic process","Any cellular process that activates or increases the frequency, rate or extent of the chemical reactions and pathways involving nucleobases, nucleosides, nucleotides and nucleic acids.","0.664% (12/1808)",0.008933967,2.05,"ENSG00000078687;ENSG00000100354;ENSG00000103449;ENSG00000114126;ENSG00000125740;ENSG00000140945;ENSG00000141905;ENSG00000148737;ENSG00000174332;ENSG00000180357;ENSG00000185920;ENSG00000198911","TNRC6C;TNRC6B;SALL1;TFDP2;FOSB;CDH13;NFIC;TCF7L2;GLIS1;ZNF609;PTCH1;SREBF2"
"127","GO:0045974","regulation of translation, ncRNA-mediated","Any process, mediated by small non-coding RNAs, that modulates the frequency, rate or extent that mRNAs are effectively translated into protein.","4.545% (2/44)",0.008477783,2.07,"ENSG00000078687;ENSG00000100354","TNRC6C;TNRC6B"
"128","GO:0046825","regulation of protein export from nucleus","Any process that modulates the frequency, rate or extent of the directed movement of proteins from the nucleus to the cytoplasm.","5.556% (2/36)",0.005737069,2.24,"ENSG00000082898;ENSG00000148737","XPO1;TCF7L2"
"129","GO:0048468","cell development","The process whose specific outcome is the progression of the cell over time, from its formation to the mature structure. Cell development does not include the steps involved in committing a cell to a specific fate.","0.996% (20/2008)",9.732708e-07,6.01,"ENSG00000018189;ENSG00000033327;ENSG00000067715;ENSG00000078114;ENSG00000102531;ENSG00000105894;ENSG00000111962;ENSG00000134775;ENSG00000138735;ENSG00000144619;ENSG00000146555;ENSG00000150593;ENSG00000163539;ENSG00000170776;ENSG00000179915;ENSG00000182168;ENSG00000182197;ENSG00000185920;ENSG00000187323;ENSG00000257923","RUFY3;GAB2;SYT1;NEBL;FNDC3A;PTN;UST;FHOD3;PDE5A;CNTN4;SDK1;PDCD4;CLASP2;AKAP13;NRXN1;UNC5C;EXT1;PTCH1;DCC;CUX1"
"130","GO:0048513","animal organ development","Development of a tissue or tissues that work together to perform a specific function or functions. Development pertains to the process whose specific outcome is the progression of a structure over time, from its formation to the mature structure. Organs are commonly observed as visibly distinct structures, but may also exist as loosely associated clusters of cells that work together to perform a specific function or functions.","0.811% (27/3331)",2.311227e-07,6.64,"ENSG00000033327;ENSG00000067715;ENSG00000078114;ENSG00000078687;ENSG00000100354;ENSG00000102531;ENSG00000103449;ENSG00000105894;ENSG00000112320;ENSG00000114126;ENSG00000134775;ENSG00000138829;ENSG00000141905;ENSG00000144619;ENSG00000146555;ENSG00000148737;ENSG00000150593;ENSG00000163539;ENSG00000170776;ENSG00000170962;ENSG00000179915;ENSG00000180357;ENSG00000182168;ENSG00000182197;ENSG00000185737;ENSG00000185920;ENSG00000187323","GAB2;SYT1;NEBL;TNRC6C;TNRC6B;FNDC3A;SALL1;PTN;SOBP;TFDP2;FHOD3;FBN2;NFIC;CNTN4;SDK1;TCF7L2;PDCD4;CLASP2;AKAP13;PDGFD;NRXN1;ZNF609;UNC5C;EXT1;NRG3;PTCH1;DCC"
"131","GO:0048518","positive regulation of biological process","Any process that activates or increases the frequency, rate or extent of a biological process. Biological processes are regulated by many means; examples include the control of gene expression, protein modification or interaction with a protein or substrate molecule.","0.524% (30/5723)",0.0004051717,3.39,"ENSG00000018189;ENSG00000033327;ENSG00000054523;ENSG00000067715;ENSG00000078687;ENSG00000100354;ENSG00000101282;ENSG00000103449;ENSG00000105894;ENSG00000114126;ENSG00000115977;ENSG00000125740;ENSG00000138735;ENSG00000138829;ENSG00000140945;ENSG00000141905;ENSG00000148737;ENSG00000150593;ENSG00000163539;ENSG00000165995;ENSG00000170776;ENSG00000170962;ENSG00000174332;ENSG00000179915;ENSG00000180357;ENSG00000182168;ENSG00000185737;ENSG00000185920;ENSG00000198911;ENSG00000257923","RUFY3;GAB2;KIF1B;SYT1;TNRC6C;TNRC6B;RSPO4;SALL1;PTN;TFDP2;AAK1;FOSB;PDE5A;FBN2;CDH13;NFIC;TCF7L2;PDCD4;CLASP2;CACNB2;AKAP13;PDGFD;GLIS1;NRXN1;ZNF609;UNC5C;NRG3;PTCH1;SREBF2;CUX1"
"132","GO:0048519","negative regulation of biological process","Any process that stops, prevents, or reduces the frequency, rate or extent of a biological process. Biological processes are regulated by many means; examples include the control of gene expression, protein modification or interaction with a protein or substrate molecule.","0.483% (25/5177)",0.007482738,2.13,"ENSG00000018189;ENSG00000078687;ENSG00000082898;ENSG00000100354;ENSG00000103449;ENSG00000105894;ENSG00000114126;ENSG00000125740;ENSG00000134775;ENSG00000138735;ENSG00000138829;ENSG00000140945;ENSG00000141905;ENSG00000144619;ENSG00000148737;ENSG00000150593;ENSG00000163539;ENSG00000174332;ENSG00000179915;ENSG00000185737;ENSG00000185920;ENSG00000187323;ENSG00000196277;ENSG00000198911;ENSG00000257923","RUFY3;TNRC6C;XPO1;TNRC6B;SALL1;PTN;TFDP2;FOSB;FHOD3;PDE5A;FBN2;CDH13;NFIC;CNTN4;TCF7L2;PDCD4;CLASP2;GLIS1;NRXN1;NRG3;PTCH1;DCC;GRM7;SREBF2;CUX1"
"133","GO:0048522","positive regulation of cellular process","Any process that activates or increases the frequency, rate or extent of a cellular process, any of those that are carried out at the cellular level, but are not necessarily restricted to a single cell. For example, cell communication occurs among more than one cell, but occurs at the cellular level.","0.553% (29/5248)",0.0002121746,3.67,"ENSG00000018189;ENSG00000033327;ENSG00000067715;ENSG00000078687;ENSG00000100354;ENSG00000101282;ENSG00000103449;ENSG00000105894;ENSG00000114126;ENSG00000115977;ENSG00000125740;ENSG00000138735;ENSG00000138829;ENSG00000140945;ENSG00000141905;ENSG00000148737;ENSG00000150593;ENSG00000163539;ENSG00000165995;ENSG00000170776;ENSG00000170962;ENSG00000174332;ENSG00000179915;ENSG00000180357;ENSG00000182168;ENSG00000185737;ENSG00000185920;ENSG00000198911;ENSG00000257923","RUFY3;GAB2;SYT1;TNRC6C;TNRC6B;RSPO4;SALL1;PTN;TFDP2;AAK1;FOSB;PDE5A;FBN2;CDH13;NFIC;TCF7L2;PDCD4;CLASP2;CACNB2;AKAP13;PDGFD;GLIS1;NRXN1;ZNF609;UNC5C;NRG3;PTCH1;SREBF2;CUX1"
"134","GO:0048523","negative regulation of cellular process","Any process that stops, prevents, or reduces the frequency, rate or extent of a cellular process, any of those that are carried out at the cellular level, but are not necessarily restricted to a single cell. For example, cell communication occurs among more than one cell, but occurs at the cellular level.","0.536% (25/4664)",0.001566112,2.81,"ENSG00000018189;ENSG00000078687;ENSG00000082898;ENSG00000100354;ENSG00000103449;ENSG00000105894;ENSG00000114126;ENSG00000125740;ENSG00000134775;ENSG00000138735;ENSG00000138829;ENSG00000140945;ENSG00000141905;ENSG00000144619;ENSG00000148737;ENSG00000150593;ENSG00000163539;ENSG00000174332;ENSG00000179915;ENSG00000185737;ENSG00000185920;ENSG00000187323;ENSG00000196277;ENSG00000198911;ENSG00000257923","RUFY3;TNRC6C;XPO1;TNRC6B;SALL1;PTN;TFDP2;FOSB;FHOD3;PDE5A;FBN2;CDH13;NFIC;CNTN4;TCF7L2;PDCD4;CLASP2;GLIS1;NRXN1;NRG3;PTCH1;DCC;GRM7;SREBF2;CUX1"
"135","GO:0048588","developmental cell growth","The growth of a cell, where growth contributes to the progression of the cell over time from one condition to another.","2.193% (5/228)",0.0007335932,3.13,"ENSG00000018189;ENSG00000067715;ENSG00000163539;ENSG00000170776;ENSG00000187323","RUFY3;SYT1;CLASP2;AKAP13;DCC"
"136","GO:0048589","developmental growth","The increase in size or mass of an entire organism, a part of an organism or a cell, where the increase in size or mass has the specific outcome of the progression of the organism over time from one condition to another.","1.402% (9/642)",0.0001538716,3.81,"ENSG00000018189;ENSG00000067715;ENSG00000103449;ENSG00000105894;ENSG00000163539;ENSG00000170776;ENSG00000182197;ENSG00000185920;ENSG00000187323","RUFY3;SYT1;SALL1;PTN;CLASP2;AKAP13;EXT1;PTCH1;DCC"
"137","GO:0048598","embryonic morphogenesis","The process in which anatomical structures are generated and organized during the embryonic phase. The embryonic phase begins with zygote formation. The end of the embryonic phase is organism-specific. For example, it would be at birth for mammals, larval hatching for insects and seed dormancy in plants.","1.04% (6/577)",0.009204552,2.04,"ENSG00000103449;ENSG00000112320;ENSG00000138829;ENSG00000163539;ENSG00000182197;ENSG00000185920","SALL1;SOBP;FBN2;CLASP2;EXT1;PTCH1"
"138","GO:0048638","regulation of developmental growth","Any process that modulates the frequency, rate or extent of developmental growth.","1.534% (5/326)",0.003529647,2.45,"ENSG00000018189;ENSG00000067715;ENSG00000163539;ENSG00000185920;ENSG00000187323","RUFY3;SYT1;CLASP2;PTCH1;DCC"
"139","GO:0048646","anatomical structure formation involved in morphogenesis","The developmental process pertaining to the initial formation of an anatomical structure from unspecified parts. This process begins with the specific processes that contribute to the appearance of the discrete structure and ends when the structural rudiment is recognizable. An anatomical structure is any biological entity that occupies space and is distinguished from its surroundings. Anatomical structures can be macroscopic such as a carpel, or microscopic such as an acrosome.","1.196% (13/1087)",2.156188e-05,4.67,"ENSG00000078114;ENSG00000103449;ENSG00000105894;ENSG00000134775;ENSG00000138829;ENSG00000140945;ENSG00000146555;ENSG00000163539;ENSG00000170776;ENSG00000179915;ENSG00000182197;ENSG00000185737;ENSG00000185920","NEBL;SALL1;PTN;FHOD3;FBN2;CDH13;SDK1;CLASP2;AKAP13;NRXN1;EXT1;NRG3;PTCH1"
"140","GO:0048659","smooth muscle cell proliferation","The multiplication or reproduction of smooth muscle cells, resulting in the expansion of a cell population.","2.837% (4/141)",0.001003277,3,"ENSG00000140945;ENSG00000148737;ENSG00000150593;ENSG00000170962","CDH13;TCF7L2;PDCD4;PDGFD"
"141","GO:0048660","regulation of smooth muscle cell proliferation","Any process that modulates the frequency, rate or extent of smooth muscle cell proliferation.","2.878% (4/139)",0.0009513344,3.02,"ENSG00000140945;ENSG00000148737;ENSG00000150593;ENSG00000170962","CDH13;TCF7L2;PDCD4;PDGFD"
"142","GO:0048666","neuron development","The process whose specific outcome is the progression of a neuron over time, from initial commitment of the cell to a specific fate, to the fully functional differentiated cell.","1.248% (14/1122)",5.819616e-06,5.24,"ENSG00000018189;ENSG00000033327;ENSG00000067715;ENSG00000105894;ENSG00000111962;ENSG00000144619;ENSG00000146555;ENSG00000163539;ENSG00000179915;ENSG00000182168;ENSG00000182197;ENSG00000185920;ENSG00000187323;ENSG00000257923","RUFY3;GAB2;SYT1;PTN;UST;CNTN4;SDK1;CLASP2;NRXN1;UNC5C;EXT1;PTCH1;DCC;CUX1"
"143","GO:0048667","cell morphogenesis involved in neuron differentiation","The process in which the structures of a neuron are generated and organized. This process occurs while the initially relatively unspecialized cell is acquiring the specialized features of a neuron.","2.01% (12/597)",2.283152e-07,6.64,"ENSG00000018189;ENSG00000033327;ENSG00000105894;ENSG00000111962;ENSG00000144619;ENSG00000163539;ENSG00000179915;ENSG00000182168;ENSG00000182197;ENSG00000185920;ENSG00000187323;ENSG00000257923","RUFY3;GAB2;PTN;UST;CNTN4;CLASP2;NRXN1;UNC5C;EXT1;PTCH1;DCC;CUX1"
"144","GO:0048699","generation of neurons","The process in which nerve cells are generated. This includes the production of neuroblasts and their differentiation into neurons.","1.127% (17/1508)",1.678994e-06,5.77,"ENSG00000018189;ENSG00000033327;ENSG00000067715;ENSG00000103449;ENSG00000105894;ENSG00000111962;ENSG00000144619;ENSG00000146555;ENSG00000163539;ENSG00000179915;ENSG00000180357;ENSG00000182168;ENSG00000182197;ENSG00000185737;ENSG00000185920;ENSG00000187323;ENSG00000257923","RUFY3;GAB2;SYT1;SALL1;PTN;UST;CNTN4;SDK1;CLASP2;NRXN1;ZNF609;UNC5C;EXT1;NRG3;PTCH1;DCC;CUX1"
"145","GO:0048731","system development","The process whose specific outcome is the progression of an organismal system over time, from its formation to the mature structure. A system is a regularly interacting or interdependent group of organs or tissues that work together to carry out a given biological process.","0.72% (33/4586)",3.839667e-08,7.42,"ENSG00000018189;ENSG00000033327;ENSG00000038427;ENSG00000067715;ENSG00000078114;ENSG00000078687;ENSG00000100354;ENSG00000102531;ENSG00000103449;ENSG00000105894;ENSG00000111962;ENSG00000112320;ENSG00000114126;ENSG00000120549;ENSG00000134775;ENSG00000138829;ENSG00000140945;ENSG00000141905;ENSG00000144619;ENSG00000146555;ENSG00000148737;ENSG00000150593;ENSG00000163539;ENSG00000170776;ENSG00000170962;ENSG00000179915;ENSG00000180357;ENSG00000182168;ENSG00000182197;ENSG00000185737;ENSG00000185920;ENSG00000187323;ENSG00000257923","RUFY3;GAB2;VCAN;SYT1;NEBL;TNRC6C;TNRC6B;FNDC3A;SALL1;PTN;UST;SOBP;TFDP2;KIAA1217;FHOD3;FBN2;CDH13;NFIC;CNTN4;SDK1;TCF7L2;PDCD4;CLASP2;AKAP13;PDGFD;NRXN1;ZNF609;UNC5C;EXT1;NRG3;PTCH1;DCC;CUX1"
"146","GO:0048736","appendage development","The process whose specific outcome is the progression of an appendage over time, from its formation to the mature structure. An appendage is an organ or part that is attached to the trunk of an organism, such as a limb or a branch.","2.809% (5/178)",0.0002363306,3.63,"ENSG00000101282;ENSG00000103449;ENSG00000138829;ENSG00000182197;ENSG00000185920","RSPO4;SALL1;FBN2;EXT1;PTCH1"
"147","GO:0048762","mesenchymal cell differentiation","The process in which a relatively unspecialized cell acquires specialized features of a mesenchymal cell. A mesenchymal cell is a loosely associated cell that is part of the connective tissue in an organism. Mesenchymal cells give rise to more mature connective tissue cell types.","1.835% (4/218)",0.004876941,2.31,"ENSG00000148737;ENSG00000150593;ENSG00000163539;ENSG00000182197","TCF7L2;PDCD4;CLASP2;EXT1"
"148","GO:0048812","neuron projection morphogenesis","The process in which the anatomical structures of a neuron projection are generated and organized. A neuron projection is any process extending from a neural cell, such as axons or dendrites.","1.988% (13/654)",7.317489e-08,7.14,"ENSG00000018189;ENSG00000033327;ENSG00000067715;ENSG00000105894;ENSG00000111962;ENSG00000144619;ENSG00000163539;ENSG00000179915;ENSG00000182168;ENSG00000182197;ENSG00000185920;ENSG00000187323;ENSG00000257923","RUFY3;GAB2;SYT1;PTN;UST;CNTN4;CLASP2;NRXN1;UNC5C;EXT1;PTCH1;DCC;CUX1"
