"","GO.ID","term","definition","condition.genes_frequency","condition.pvalue","condition.-log10_pvalue","condition.Significant_genes","condition.Significant_genes_symbol"
"169","GO:0035113","embryonic appendage morphogenesis","The process, occurring in the embryo, by which the anatomical structures of the appendage are generated and organized. An appendage is an organ or part that is attached to the trunk of an organism, such as a limb or a branch.","3.28% (4/122)",0.0006005661,3.22,"ENSG00000116132;ENSG00000124813;ENSG00000138829;ENSG00000185920","PRRX1;RUNX2;FBN2;PTCH1"
"170","GO:0035148","tube formation","Creation of the central hole of a tube in an anatomical structure through which gases and/or liquids flow.","2.67% (4/150)",0.001298137,2.89,"ENSG00000139174;ENSG00000164741;ENSG00000169554;ENSG00000185920","PRICKLE1;DLC1;ZEB2;PTCH1"
"171","GO:0035239","tube morphogenesis","The process in which the anatomical structures of a tube are generated and organized. Epithelial and endothelial tubes transport gases, liquids and cells from one site to another and form the basic structure of many organs and tissues, with tube shape and organization varying from the single-celled excretory organ in Caenorhabditis elegans to the branching trees of the mammalian kidney and insect tracheal system.","1.29% (11/851)",5.665285e-05,4.25,"ENSG00000048052;ENSG00000112562;ENSG00000116132;ENSG00000139174;ENSG00000164741;ENSG00000168542;ENSG00000169554;ENSG00000169855;ENSG00000179915;ENSG00000184304;ENSG00000185920","HDAC9;SMOC2;PRRX1;PRICKLE1;DLC1;COL3A1;ZEB2;ROBO1;NRXN1;PRKD1;PTCH1"
"172","GO:0035268","protein mannosylation","The addition of a mannose residue to a protein acceptor molecule.","8.33% (2/24)",0.002613822,2.58,"ENSG00000133687;ENSG00000179104","TMTC1;TMTC2"
"173","GO:0035269","protein O-linked mannosylation","The transfer of mannose from dolichyl activated mannose to the hydroxyl group of a seryl or threonyl residue of a protein acceptor molecule, to form an O-linked protein-sugar linkage.","10.53% (2/19)",0.001635922,2.79,"ENSG00000133687;ENSG00000179104","TMTC1;TMTC2"
"174","GO:0035295","tube development","The process whose specific outcome is the progression of a tube over time, from its initial formation to a mature structure. Epithelial and endothelial tubes transport gases, liquids and cells from one site to another and form the basic structure of many organs and tissues including lung and trachea, kidney, the mammary gland, the vascular system and the gastrointestinal and urinary-genital tracts.","1.26% (13/1035)",1.387071e-05,4.86,"ENSG00000048052;ENSG00000112562;ENSG00000116132;ENSG00000139174;ENSG00000164741;ENSG00000166250;ENSG00000168542;ENSG00000169554;ENSG00000169855;ENSG00000179915;ENSG00000184304;ENSG00000185008;ENSG00000185920","HDAC9;SMOC2;PRRX1;PRICKLE1;DLC1;CLMP;COL3A1;ZEB2;ROBO1;NRXN1;PRKD1;ROBO2;PTCH1"
"175","GO:0035385","Roundabout signaling pathway","A series of molecular signals initiated by the binding of a SLIT protein to a Roundabout (ROBO) family receptor on the surface of a target cell, and ending with regulation of a downstream cellular process, e.g. transcription.","40% (2/5)",9.842594e-05,4.01,"ENSG00000169855;ENSG00000184347","ROBO1;SLIT3"
"176","GO:0035767","endothelial cell chemotaxis","The directed movement of an endothelial cell guided by a specific chemical concentration gradient. Movement may be towards a higher concentration (positive chemotaxis) or towards a lower concentration (negative chemotaxis).","6.67% (2/30)",0.004069892,2.39,"ENSG00000112562;ENSG00000184304","SMOC2;PRKD1"
"177","GO:0035904","aorta development","The progression of the aorta over time, from its initial formation to the mature structure. An aorta is an artery that carries blood from the heart to other parts of the body.","7.14% (4/56)",2.928136e-05,4.53,"ENSG00000139174;ENSG00000168542;ENSG00000169855;ENSG00000185008","PRICKLE1;COL3A1;ROBO1;ROBO2"
"178","GO:0035924","cellular response to vascular endothelial growth factor stimulus","Any process that results in a change in state or activity of a cell (in terms of movement, secretion, enzyme production, gene expression, etc.) as a result of a vascular endothelial growth factor stimulus.","4.35% (3/69)",0.001364842,2.86,"ENSG00000112562;ENSG00000169855;ENSG00000184304","SMOC2;ROBO1;PRKD1"
"179","GO:0036211","protein modification process","The covalent alteration of one or more amino acids occurring in proteins, peptides and nascent polypeptides (co-translational, post-translational modifications). Includes the modification of charged tRNAs that are destined to occur in a protein (pre-translation modification).","0.57% (22/3892)",0.002081366,2.68,"ENSG00000038427;ENSG00000044524;ENSG00000048052;ENSG00000121440;ENSG00000129682;ENSG00000133687;ENSG00000138735;ENSG00000139174;ENSG00000150672;ENSG00000153707;ENSG00000164741;ENSG00000168542;ENSG00000169554;ENSG00000169855;ENSG00000174473;ENSG00000179104;ENSG00000179915;ENSG00000183580;ENSG00000184304;ENSG00000185532;ENSG00000185737;ENSG00000198947","VCAN;EPHA3;HDAC9;PDZRN3;FGF13;TMTC1;PDE5A;PRICKLE1;DLG2;PTPRD;DLC1;COL3A1;ZEB2;ROBO1;GALNTL6;TMTC2;NRXN1;FBXL7;PRKD1;PRKG1;NRG3;DMD"
"180","GO:0036445","neuronal stem cell division","The self-renewing division of a neuronal stem cell.","13.33% (2/15)",0.001012695,2.99,"ENSG00000129682;ENSG00000134532","FGF13;SOX5"
"181","GO:0038084","vascular endothelial growth factor signaling pathway","A series of molecular signals initiated by the binding of a vascular endothelial growth factor (VEGF) to a receptor on the surface of the target cell, and ending with regulation of a downstream cellular process, e.g. transcription.","6.38% (3/47)",0.0004436021,3.35,"ENSG00000112562;ENSG00000169855;ENSG00000184304","SMOC2;ROBO1;PRKD1"
"182","GO:0040011","locomotion","Self-propelled movement of a cell or organism from one location to another.","1.02% (18/1759)",3.346092e-06,5.48,"ENSG00000038427;ENSG00000044524;ENSG00000048052;ENSG00000112562;ENSG00000119042;ENSG00000129682;ENSG00000144619;ENSG00000164741;ENSG00000168542;ENSG00000169554;ENSG00000169855;ENSG00000179915;ENSG00000184304;ENSG00000184347;ENSG00000185008;ENSG00000185532;ENSG00000185737;ENSG00000185920","VCAN;EPHA3;HDAC9;SMOC2;SATB2;FGF13;CNTN4;DLC1;COL3A1;ZEB2;ROBO1;NRXN1;PRKD1;SLIT3;ROBO2;PRKG1;NRG3;PTCH1"
"183","GO:0040012","regulation of locomotion","Any process that modulates the frequency, rate or extent of locomotion of a cell or organism.","0.91% (9/984)",0.003428387,2.46,"ENSG00000048052;ENSG00000112562;ENSG00000164741;ENSG00000168542;ENSG00000169855;ENSG00000184304;ENSG00000185008;ENSG00000185532;ENSG00000185737","HDAC9;SMOC2;DLC1;COL3A1;ROBO1;PRKD1;ROBO2;PRKG1;NRG3"
"184","GO:0040013","negative regulation of locomotion","Any process that stops, prevents, or reduces the frequency, rate or extent of locomotion of a cell or organism.","1.83% (6/328)",0.0005720843,3.24,"ENSG00000164741;ENSG00000168542;ENSG00000169855;ENSG00000185008;ENSG00000185532;ENSG00000185737","DLC1;COL3A1;ROBO1;ROBO2;PRKG1;NRG3"
"185","GO:0040036","regulation of fibroblast growth factor receptor signaling pathway","Any process that modulates the frequency, rate or extent of fibroblast growth factor receptor signaling pathway activity.","8.82% (3/34)",0.0001685244,3.77,"ENSG00000112562;ENSG00000124813;ENSG00000179915","SMOC2;RUNX2;NRXN1"
"186","GO:0042297","vocal learning","A behavioral process whose outcome is a relatively long-lasting behavioral change whereby an organism modifies innate vocalizations to imitate sounds produced by others.","33.33% (2/6)",0.0001473391,3.83,"ENSG00000174469;ENSG00000179915","CNTNAP2;NRXN1"
"187","GO:0042330","taxis","The directed movement of a motile cell or organism in response to an external stimulus.","1.74% (10/575)",1.052791e-05,4.98,"ENSG00000044524;ENSG00000112562;ENSG00000144619;ENSG00000169855;ENSG00000179915;ENSG00000184304;ENSG00000184347;ENSG00000185008;ENSG00000185737;ENSG00000185920","EPHA3;SMOC2;CNTN4;ROBO1;NRXN1;PRKD1;SLIT3;ROBO2;NRG3;PTCH1"
"188","GO:0043009","chordate embryonic development","The process whose specific outcome is the progression of the embryo over time, from zygote formation through a stage including a notochord and neural tube until birth or egg hatching.","1.11% (7/630)",0.003544017,2.45,"ENSG00000116132;ENSG00000119042;ENSG00000124813;ENSG00000139174;ENSG00000164741;ENSG00000169554;ENSG00000185920","PRRX1;SATB2;RUNX2;PRICKLE1;DLC1;ZEB2;PTCH1"
"189","GO:0043412","macromolecule modification","The covalent alteration of one or more monomeric units in a polypeptide, polynucleotide, polysaccharide, or other biological macromolecule, resulting in a change in its properties.","0.54% (22/4088)",0.004042885,2.39,"ENSG00000038427;ENSG00000044524;ENSG00000048052;ENSG00000121440;ENSG00000129682;ENSG00000133687;ENSG00000138735;ENSG00000139174;ENSG00000150672;ENSG00000153707;ENSG00000164741;ENSG00000168542;ENSG00000169554;ENSG00000169855;ENSG00000174473;ENSG00000179104;ENSG00000179915;ENSG00000183580;ENSG00000184304;ENSG00000185532;ENSG00000185737;ENSG00000198947","VCAN;EPHA3;HDAC9;PDZRN3;FGF13;TMTC1;PDE5A;PRICKLE1;DLG2;PTPRD;DLC1;COL3A1;ZEB2;ROBO1;GALNTL6;TMTC2;NRXN1;FBXL7;PRKD1;PRKG1;NRG3;DMD"
"190","GO:0043534","blood vessel endothelial cell migration","The orderly movement of an endothelial cell into the extracellular matrix in order to form new blood vessels during angiogenesis.","2.31% (3/130)",0.008140654,2.09,"ENSG00000048052;ENSG00000169855;ENSG00000184304","HDAC9;ROBO1;PRKD1"
"191","GO:0043542","endothelial cell migration","The orderly movement of an endothelial cell into the extracellular matrix to form an endothelium.","1.74% (4/230)",0.006047662,2.22,"ENSG00000048052;ENSG00000112562;ENSG00000169855;ENSG00000184304","HDAC9;SMOC2;ROBO1;PRKD1"
"192","GO:0043549","regulation of kinase activity","Any process that modulates the frequency, rate or extent of kinase activity, the catalysis of the transfer of a phosphate group, usually from ATP, to a substrate molecule.","0.92% (8/868)",0.005627463,2.25,"ENSG00000044524;ENSG00000129682;ENSG00000138735;ENSG00000169554;ENSG00000169855;ENSG00000179915;ENSG00000184304;ENSG00000185737","EPHA3;FGF13;PDE5A;ZEB2;ROBO1;NRXN1;PRKD1;NRG3"
"193","GO:0043616","keratinocyte proliferation","The multiplication or reproduction of keratinocytes, resulting in the expansion of a cell population. Keratinocytes are epidermal cells which synthesize keratin and undergo a characteristic change as they move upward from the basal layers of the epidermis to the cornified (horny) layer of the skin.","4.35% (2/46)",0.009375711,2.03,"ENSG00000184304;ENSG00000185920","PRKD1;PTCH1"
"194","GO:0044057","regulation of system process","Any process that modulates the frequency, rate or extent of a system process, a multicellular organismal process carried out by any of the organs or tissues in an organ system.","1.09% (6/552)",0.007754317,2.11,"ENSG00000129682;ENSG00000138735;ENSG00000165995;ENSG00000179915;ENSG00000185532;ENSG00000198947","FGF13;PDE5A;CACNB2;NRXN1;PRKG1;DMD"
"195","GO:0044091","membrane biogenesis","A cellular process that results in the biosynthesis of constituent macromolecules, assembly, and arrangement of constituent parts of a membrane.","7.69% (3/39)",0.0002545212,3.59,"ENSG00000153707;ENSG00000169306;ENSG00000179915","PTPRD;IL1RAPL1;NRXN1"
"196","GO:0044344","cellular response to fibroblast growth factor stimulus","Any process that results in a change in state or activity of a cell (in terms of movement, secretion, enzyme production, gene expression, etc.) as a result of an fibroblast growth factor stimulus.","2.17% (3/138)",0.009580347,2.02,"ENSG00000112562;ENSG00000124813;ENSG00000179915","SMOC2;RUNX2;NRXN1"
"197","GO:0045165","cell fate commitment","The commitment of cells to specific cell fates and their capacity to differentiate into particular kinds of cells. Positional information is established through protein signals that emanate from a localized source within a cell (the initial one-cell zygote) or within a developmental field.","2.62% (6/229)",8.228777e-05,4.08,"ENSG00000116132;ENSG00000119042;ENSG00000124813;ENSG00000129682;ENSG00000134532;ENSG00000185920","PRRX1;SATB2;RUNX2;FGF13;SOX5;PTCH1"
"198","GO:0045595","regulation of cell differentiation","Any process that modulates the frequency, rate or extent of cell differentiation, the process in which relatively unspecialized cells acquire specialized structural and functional features.","1.19% (21/1763)",2.251907e-08,7.65,"ENSG00000044524;ENSG00000048052;ENSG00000116132;ENSG00000124813;ENSG00000129682;ENSG00000134532;ENSG00000138735;ENSG00000138829;ENSG00000139174;ENSG00000144619;ENSG00000153707;ENSG00000168542;ENSG00000169306;ENSG00000169554;ENSG00000169855;ENSG00000172260;ENSG00000184304;ENSG00000185008;ENSG00000185737;ENSG00000185920;ENSG00000198947","EPHA3;HDAC9;PRRX1;RUNX2;FGF13;SOX5;PDE5A;FBN2;PRICKLE1;CNTN4;PTPRD;COL3A1;IL1RAPL1;ZEB2;ROBO1;NEGR1;PRKD1;ROBO2;NRG3;PTCH1;DMD"
"199","GO:0045596","negative regulation of cell differentiation","Any process that stops, prevents, or reduces the frequency, rate or extent of cell differentiation.","1.04% (7/671)",0.005003933,2.3,"ENSG00000129682;ENSG00000139174;ENSG00000144619;ENSG00000168542;ENSG00000185737;ENSG00000185920;ENSG00000198947","FGF13;PRICKLE1;CNTN4;COL3A1;NRG3;PTCH1;DMD"
"200","GO:0045597","positive regulation of cell differentiation","Any process that activates or increases the frequency, rate or extent of cell differentiation.","1.48% (14/949)",8.828059e-07,6.05,"ENSG00000044524;ENSG00000124813;ENSG00000134532;ENSG00000138735;ENSG00000138829;ENSG00000153707;ENSG00000169306;ENSG00000169554;ENSG00000169855;ENSG00000172260;ENSG00000184304;ENSG00000185008;ENSG00000185920;ENSG00000198947","EPHA3;RUNX2;SOX5;PDE5A;FBN2;PTPRD;IL1RAPL1;ZEB2;ROBO1;NEGR1;PRKD1;ROBO2;PTCH1;DMD"
"201","GO:0045664","regulation of neuron differentiation","Any process that modulates the frequency, rate or extent of neuron differentiation.","1.85% (12/650)",6.156307e-07,6.21,"ENSG00000044524;ENSG00000116132;ENSG00000129682;ENSG00000144619;ENSG00000153707;ENSG00000169306;ENSG00000169554;ENSG00000169855;ENSG00000172260;ENSG00000184304;ENSG00000185008;ENSG00000198947","EPHA3;PRRX1;FGF13;CNTN4;PTPRD;IL1RAPL1;ZEB2;ROBO1;NEGR1;PRKD1;ROBO2;DMD"
"202","GO:0045666","positive regulation of neuron differentiation","Any process that activates or increases the frequency, rate or extent of neuron differentiation.","2.49% (9/361)",1.705784e-06,5.77,"ENSG00000044524;ENSG00000153707;ENSG00000169306;ENSG00000169554;ENSG00000169855;ENSG00000172260;ENSG00000184304;ENSG00000185008;ENSG00000198947","EPHA3;PTPRD;IL1RAPL1;ZEB2;ROBO1;NEGR1;PRKD1;ROBO2;DMD"
"203","GO:0045667","regulation of osteoblast differentiation","Any process that modulates the frequency, rate or extent of osteoblast differentiation.","3.25% (4/123)",0.0006193131,3.21,"ENSG00000124813;ENSG00000138829;ENSG00000184304;ENSG00000185920","RUNX2;FBN2;PRKD1;PTCH1"
"204","GO:0045669","positive regulation of osteoblast differentiation","Any process that activates or increases the frequency, rate or extent of osteoblast differentiation.","4.76% (3/63)",0.001048357,2.98,"ENSG00000124813;ENSG00000138829;ENSG00000184304","RUNX2;FBN2;PRKD1"
"205","GO:0045743","positive regulation of fibroblast growth factor receptor signaling pathway","Any process that activates or increases the frequency, rate or extent of fibroblast growth factor receptor signaling pathway activity.","25% (2/8)",0.0002739174,3.56,"ENSG00000112562;ENSG00000179915","SMOC2;NRXN1"
"206","GO:0045778","positive regulation of ossification","Any process that activates or increases the frequency, rate or extent of ossification, the formation of bone or of a bony substance or the conversion of fibrous tissue or of cartilage into bone or a bony substance.","3.3% (3/91)",0.003013675,2.52,"ENSG00000124813;ENSG00000138829;ENSG00000184304","RUNX2;FBN2;PRKD1"
"207","GO:0045860","positive regulation of protein kinase activity","Any process that activates or increases the frequency, rate or extent of protein kinase activity.","1.16% (6/518)",0.005732697,2.24,"ENSG00000129682;ENSG00000138735;ENSG00000169554;ENSG00000169855;ENSG00000179915;ENSG00000185737","FGF13;PDE5A;ZEB2;ROBO1;NRXN1;NRG3"
"208","GO:0045879","negative regulation of smoothened signaling pathway","Any process that stops, prevents, or reduces the frequency, rate or extent of smoothened signaling.","5.56% (2/36)",0.005823276,2.23,"ENSG00000124813;ENSG00000185920","RUNX2;PTCH1"
"209","GO:0045932","negative regulation of muscle contraction","Any process that stops, prevents, or reduces the frequency, rate or extent of muscle contraction.","8% (2/25)",0.002835364,2.55,"ENSG00000138735;ENSG00000185532","PDE5A;PRKG1"
"210","GO:0045937","positive regulation of phosphate metabolic process","Any process that activates or increases the frequency, rate or extent of the chemical reactions and pathways involving phosphates.","0.85% (9/1064)",0.005732985,2.24,"ENSG00000044524;ENSG00000129682;ENSG00000138735;ENSG00000164741;ENSG00000169554;ENSG00000169855;ENSG00000179915;ENSG00000184304;ENSG00000185737","EPHA3;FGF13;PDE5A;DLC1;ZEB2;ROBO1;NRXN1;PRKD1;NRG3"
"211","GO:0048103","somatic stem cell division","The self-renewing division of a somatic stem cell, a stem cell that can give rise to cell types of the body other than those of the germ-line.","8% (2/25)",0.002835364,2.55,"ENSG00000129682;ENSG00000134532","FGF13;SOX5"
"212","GO:0048468","cell development","The process whose specific outcome is the progression of the cell over time, from its formation to the mature structure. Cell development does not include the steps involved in committing a cell to a specific fate.","1.21% (25/2069)",2.931217e-10,9.53,"ENSG00000044524;ENSG00000048052;ENSG00000116132;ENSG00000119042;ENSG00000124813;ENSG00000129682;ENSG00000138735;ENSG00000140937;ENSG00000144619;ENSG00000153707;ENSG00000154654;ENSG00000168542;ENSG00000169306;ENSG00000169554;ENSG00000169855;ENSG00000172260;ENSG00000174469;ENSG00000179915;ENSG00000184304;ENSG00000184347;ENSG00000185008;ENSG00000185532;ENSG00000185737;ENSG00000185920;ENSG00000198947","EPHA3;HDAC9;PRRX1;SATB2;RUNX2;FGF13;PDE5A;CDH11;CNTN4;PTPRD;NCAM2;COL3A1;IL1RAPL1;ZEB2;ROBO1;NEGR1;CNTNAP2;NRXN1;PRKD1;SLIT3;ROBO2;PRKG1;NRG3;PTCH1;DMD"
"213","GO:0048513","animal organ development","Development of a tissue or tissues that work together to perform a specific function or functions. Development pertains to the process whose specific outcome is the progression of a structure over time, from its formation to the mature structure. Organs are commonly observed as visibly distinct structures, but may also exist as loosely associated clusters of cells that work together to perform a specific function or functions.","0.7% (23/3300)",5.7176e-05,4.24,"ENSG00000044524;ENSG00000048052;ENSG00000116132;ENSG00000119042;ENSG00000124813;ENSG00000129682;ENSG00000134532;ENSG00000138829;ENSG00000139174;ENSG00000144619;ENSG00000164741;ENSG00000168542;ENSG00000169554;ENSG00000169855;ENSG00000174469;ENSG00000179915;ENSG00000184347;ENSG00000185008;ENSG00000185532;ENSG00000185737;ENSG00000185920;ENSG00000189337;ENSG00000198947","EPHA3;HDAC9;PRRX1;SATB2;RUNX2;FGF13;SOX5;FBN2;PRICKLE1;CNTN4;DLC1;COL3A1;ZEB2;ROBO1;CNTNAP2;NRXN1;SLIT3;ROBO2;PRKG1;NRG3;PTCH1;KAZN;DMD"
"214","GO:0048514","blood vessel morphogenesis","The process in which the anatomical structures of blood vessels are generated and organized. The blood vessel is the vasculature carrying blood.","1.16% (7/605)",0.002830478,2.55,"ENSG00000048052;ENSG00000112562;ENSG00000116132;ENSG00000168542;ENSG00000169855;ENSG00000179915;ENSG00000184304","HDAC9;SMOC2;PRRX1;COL3A1;ROBO1;NRXN1;PRKD1"
"215","GO:0048518","positive regulation of biological process","Any process that activates or increases the frequency, rate or extent of a biological process. Biological processes are regulated by many means; examples include the control of gene expression, protein modification or interaction with a protein or substrate molecule.","0.49% (28/5721)",0.003191693,2.5,"ENSG00000044524;ENSG00000048052;ENSG00000101282;ENSG00000112562;ENSG00000116132;ENSG00000119042;ENSG00000124813;ENSG00000129682;ENSG00000134532;ENSG00000138735;ENSG00000138829;ENSG00000139174;ENSG00000151474;ENSG00000153707;ENSG00000160963;ENSG00000164741;ENSG00000165995;ENSG00000168542;ENSG00000169306;ENSG00000169554;ENSG00000169855;ENSG00000172260;ENSG00000179915;ENSG00000184304;ENSG00000185008;ENSG00000185737;ENSG00000185920;ENSG00000198947","EPHA3;HDAC9;RSPO4;SMOC2;PRRX1;SATB2;RUNX2;FGF13;SOX5;PDE5A;FBN2;PRICKLE1;FRMD4A;PTPRD;COL26A1;DLC1;CACNB2;COL3A1;IL1RAPL1;ZEB2;ROBO1;NEGR1;NRXN1;PRKD1;ROBO2;NRG3;PTCH1;DMD"
"216","GO:0048519","negative regulation of biological process","Any process that stops, prevents, or reduces the frequency, rate or extent of a biological process. Biological processes are regulated by many means; examples include the control of gene expression, protein modification or interaction with a protein or substrate molecule.","0.52% (27/5162)",0.001397496,2.85,"ENSG00000044524;ENSG00000048052;ENSG00000116132;ENSG00000119042;ENSG00000124813;ENSG00000129682;ENSG00000134532;ENSG00000138735;ENSG00000138829;ENSG00000139174;ENSG00000144619;ENSG00000150672;ENSG00000151474;ENSG00000164741;ENSG00000168542;ENSG00000169306;ENSG00000169554;ENSG00000169855;ENSG00000179915;ENSG00000183580;ENSG00000184304;ENSG00000184347;ENSG00000185008;ENSG00000185532;ENSG00000185737;ENSG00000185920;ENSG00000198947","EPHA3;HDAC9;PRRX1;SATB2;RUNX2;FGF13;SOX5;PDE5A;FBN2;PRICKLE1;CNTN4;DLG2;FRMD4A;DLC1;COL3A1;IL1RAPL1;ZEB2;ROBO1;NRXN1;FBXL7;PRKD1;SLIT3;ROBO2;PRKG1;NRG3;PTCH1;DMD"
"217","GO:0048522","positive regulation of cellular process","Any process that activates or increases the frequency, rate or extent of a cellular process, any of those that are carried out at the cellular level, but are not necessarily restricted to a single cell. For example, cell communication occurs among more than one cell, but occurs at the cellular level.","0.53% (27/5077)",0.001051914,2.98,"ENSG00000044524;ENSG00000048052;ENSG00000101282;ENSG00000112562;ENSG00000116132;ENSG00000119042;ENSG00000124813;ENSG00000129682;ENSG00000134532;ENSG00000138735;ENSG00000138829;ENSG00000139174;ENSG00000151474;ENSG00000153707;ENSG00000164741;ENSG00000165995;ENSG00000168542;ENSG00000169306;ENSG00000169554;ENSG00000169855;ENSG00000172260;ENSG00000179915;ENSG00000184304;ENSG00000185008;ENSG00000185737;ENSG00000185920;ENSG00000198947","EPHA3;HDAC9;RSPO4;SMOC2;PRRX1;SATB2;RUNX2;FGF13;SOX5;PDE5A;FBN2;PRICKLE1;FRMD4A;PTPRD;DLC1;CACNB2;COL3A1;IL1RAPL1;ZEB2;ROBO1;NEGR1;NRXN1;PRKD1;ROBO2;NRG3;PTCH1;DMD"
"218","GO:0048523","negative regulation of cellular process","Any process that stops, prevents, or reduces the frequency, rate or extent of a cellular process, any of those that are carried out at the cellular level, but are not necessarily restricted to a single cell. For example, cell communication occurs among more than one cell, but occurs at the cellular level.","0.59% (27/4578)",0.0001648963,3.78,"ENSG00000044524;ENSG00000048052;ENSG00000116132;ENSG00000119042;ENSG00000124813;ENSG00000129682;ENSG00000134532;ENSG00000138735;ENSG00000138829;ENSG00000139174;ENSG00000144619;ENSG00000150672;ENSG00000151474;ENSG00000164741;ENSG00000168542;ENSG00000169306;ENSG00000169554;ENSG00000169855;ENSG00000179915;ENSG00000183580;ENSG00000184304;ENSG00000184347;ENSG00000185008;ENSG00000185532;ENSG00000185737;ENSG00000185920;ENSG00000198947","EPHA3;HDAC9;PRRX1;SATB2;RUNX2;FGF13;SOX5;PDE5A;FBN2;PRICKLE1;CNTN4;DLG2;FRMD4A;DLC1;COL3A1;IL1RAPL1;ZEB2;ROBO1;NRXN1;FBXL7;PRKD1;SLIT3;ROBO2;PRKG1;NRG3;PTCH1;DMD"
"219","GO:0048568","embryonic organ development","Development, taking place during the embryonic phase, of a tissue or tissues that work together to perform a specific function or functions. Development pertains to the process whose specific outcome is the progression of a structure over time, from its formation to the mature structure. Organs are commonly observed as visibly distinct structures, but may also exist as loosely associated clusters of cells that work together to perform a specific function or functions.","1.21% (5/414)",0.009852403,2.01,"ENSG00000116132;ENSG00000119042;ENSG00000124813;ENSG00000138829;ENSG00000185920","PRRX1;SATB2;RUNX2;FBN2;PTCH1"
"220","GO:0048585","negative regulation of response to stimulus","Any process that stops, prevents, or reduces the frequency, rate or extent of a response to a stimulus. Response to stimulus is a change in state or activity of a cell or an organism (in terms of movement, secretion, enzyme production, gene expression, etc.) as a result of a stimulus.","0.75% (12/1594)",0.003459958,2.46,"ENSG00000124813;ENSG00000138829;ENSG00000139174;ENSG00000164741;ENSG00000168542;ENSG00000169855;ENSG00000179915;ENSG00000184347;ENSG00000185008;ENSG00000185532;ENSG00000185920;ENSG00000198947","RUNX2;FBN2;PRICKLE1;DLC1;COL3A1;ROBO1;NRXN1;SLIT3;ROBO2;PRKG1;PTCH1;DMD"
"221","GO:0048598","embryonic morphogenesis","The process in which anatomical structures are generated and organized during the embryonic phase. The embryonic phase begins with zygote formation. The end of the embryonic phase is organism-specific. For example, it would be at birth for mammals, larval hatching for insects and seed dormancy in plants.","1.43% (8/558)",0.0003391893,3.47,"ENSG00000116132;ENSG00000119042;ENSG00000124813;ENSG00000138829;ENSG00000139174;ENSG00000164741;ENSG00000169554;ENSG00000185920","PRRX1;SATB2;RUNX2;FBN2;PRICKLE1;DLC1;ZEB2;PTCH1"
