"","GO.ID","term","definition","condition.genes_frequency","condition.pvalue","condition.-log10_pvalue","condition.Significant_genes","condition.Significant_genes_symbol"
"222","GO:0048646","anatomical structure formation involved in morphogenesis","The developmental process pertaining to the initial formation of an anatomical structure from unspecified parts. This process begins with the specific processes that contribute to the appearance of the discrete structure and ends when the structural rudiment is recognizable. An anatomical structure is any biological entity that occupies space and is distinguished from its surroundings. Anatomical structures can be macroscopic such as a carpel, or microscopic such as an acrosome.","1.12% (12/1073)",9.942175e-05,4,"ENSG00000048052;ENSG00000112562;ENSG00000138829;ENSG00000139174;ENSG00000164741;ENSG00000169554;ENSG00000169855;ENSG00000179915;ENSG00000184304;ENSG00000185008;ENSG00000185737;ENSG00000185920","HDAC9;SMOC2;FBN2;PRICKLE1;DLC1;ZEB2;ROBO1;NRXN1;PRKD1;ROBO2;NRG3;PTCH1"
"223","GO:0048666","neuron development","The process whose specific outcome is the progression of a neuron over time, from initial commitment of the cell to a specific fate, to the fully functional differentiated cell.","1.7% (19/1116)",4.056542e-10,9.39,"ENSG00000044524;ENSG00000116132;ENSG00000129682;ENSG00000140937;ENSG00000144619;ENSG00000153707;ENSG00000154654;ENSG00000169306;ENSG00000169554;ENSG00000169855;ENSG00000172260;ENSG00000174469;ENSG00000179915;ENSG00000184304;ENSG00000184347;ENSG00000185008;ENSG00000185532;ENSG00000185920;ENSG00000198947","EPHA3;PRRX1;FGF13;CDH11;CNTN4;PTPRD;NCAM2;IL1RAPL1;ZEB2;ROBO1;NEGR1;CNTNAP2;NRXN1;PRKD1;SLIT3;ROBO2;PRKG1;PTCH1;DMD"
"224","GO:0048667","cell morphogenesis involved in neuron differentiation","The process in which the structures of a neuron are generated and organized. This process occurs while the initially relatively unspecialized cell is acquiring the specialized features of a neuron.","2.02% (12/593)",2.306356e-07,6.64,"ENSG00000044524;ENSG00000129682;ENSG00000140937;ENSG00000144619;ENSG00000153707;ENSG00000169306;ENSG00000169554;ENSG00000169855;ENSG00000179915;ENSG00000184347;ENSG00000185008;ENSG00000185920","EPHA3;FGF13;CDH11;CNTN4;PTPRD;IL1RAPL1;ZEB2;ROBO1;NRXN1;SLIT3;ROBO2;PTCH1"
"225","GO:0048668","collateral sprouting","The process in which outgrowths develop from the shafts of existing axons.","7.14% (2/28)",0.003550933,2.45,"ENSG00000129682;ENSG00000169554","FGF13;ZEB2"
"226","GO:0048699","generation of neurons","The process in which nerve cells are generated. This includes the production of neuroblasts and their differentiation into neurons.","1.66% (25/1509)",2.6132e-13,12.58,"ENSG00000044524;ENSG00000048052;ENSG00000116132;ENSG00000119042;ENSG00000124813;ENSG00000129682;ENSG00000134532;ENSG00000140937;ENSG00000144619;ENSG00000153707;ENSG00000154654;ENSG00000168542;ENSG00000169306;ENSG00000169554;ENSG00000169855;ENSG00000172260;ENSG00000174469;ENSG00000179915;ENSG00000184304;ENSG00000184347;ENSG00000185008;ENSG00000185532;ENSG00000185737;ENSG00000185920;ENSG00000198947","EPHA3;HDAC9;PRRX1;SATB2;RUNX2;FGF13;SOX5;CDH11;CNTN4;PTPRD;NCAM2;COL3A1;IL1RAPL1;ZEB2;ROBO1;NEGR1;CNTNAP2;NRXN1;PRKD1;SLIT3;ROBO2;PRKG1;NRG3;PTCH1;DMD"
"227","GO:0048701","embryonic cranial skeleton morphogenesis","The process in which the anatomical structures of the cranial skeleton are generated and organized during the embryonic phase.","4.55% (2/44)",0.008604113,2.07,"ENSG00000116132;ENSG00000124813","PRRX1;RUNX2"
"228","GO:0048704","embryonic skeletal system morphogenesis","The process in which the anatomical structures of the skeleton are generated and organized during the embryonic phase.","3.33% (3/90)",0.002920798,2.53,"ENSG00000116132;ENSG00000119042;ENSG00000124813","PRRX1;SATB2;RUNX2"
"229","GO:0048705","skeletal system morphogenesis","The process in which the anatomical structures of the skeleton are generated and organized.","2.33% (5/215)",0.0005823494,3.23,"ENSG00000116132;ENSG00000119042;ENSG00000124813;ENSG00000134532;ENSG00000138829","PRRX1;SATB2;RUNX2;SOX5;FBN2"
"230","GO:0048706","embryonic skeletal system development","The process, occurring during the embryonic phase, whose specific outcome is the progression of the skeleton over time, from its formation to the mature structure.","2.52% (3/119)",0.006384009,2.19,"ENSG00000116132;ENSG00000119042;ENSG00000124813","PRRX1;SATB2;RUNX2"
"231","GO:0048729","tissue morphogenesis","The process in which the anatomical structures of a tissue are generated and organized.","1.09% (7/645)",0.004033945,2.39,"ENSG00000139174;ENSG00000164741;ENSG00000168542;ENSG00000169554;ENSG00000169855;ENSG00000185008;ENSG00000185920","PRICKLE1;DLC1;COL3A1;ZEB2;ROBO1;ROBO2;PTCH1"
"232","GO:0048731","system development","The process whose specific outcome is the progression of an organismal system over time, from its formation to the mature structure. A system is a regularly interacting or interdependent group of organs or tissues that work together to carry out a given biological process.","0.73% (33/4537)",3.537813e-08,7.45,"ENSG00000038427;ENSG00000044524;ENSG00000048052;ENSG00000112562;ENSG00000116132;ENSG00000119042;ENSG00000124813;ENSG00000129682;ENSG00000134532;ENSG00000138829;ENSG00000139174;ENSG00000140937;ENSG00000144619;ENSG00000153707;ENSG00000154654;ENSG00000164741;ENSG00000166250;ENSG00000168542;ENSG00000169306;ENSG00000169554;ENSG00000169855;ENSG00000172260;ENSG00000174469;ENSG00000179915;ENSG00000184304;ENSG00000184347;ENSG00000185008;ENSG00000185532;ENSG00000185565;ENSG00000185737;ENSG00000185920;ENSG00000189337;ENSG00000198947","VCAN;EPHA3;HDAC9;SMOC2;PRRX1;SATB2;RUNX2;FGF13;SOX5;FBN2;PRICKLE1;CDH11;CNTN4;PTPRD;NCAM2;DLC1;CLMP;COL3A1;IL1RAPL1;ZEB2;ROBO1;NEGR1;CNTNAP2;NRXN1;PRKD1;SLIT3;ROBO2;PRKG1;LSAMP;NRG3;PTCH1;KAZN;DMD"
"233","GO:0048736","appendage development","The process whose specific outcome is the progression of an appendage over time, from its formation to the mature structure. An appendage is an organ or part that is attached to the trunk of an organism, such as a limb or a branch.","2.86% (5/175)",0.000226293,3.65,"ENSG00000101282;ENSG00000116132;ENSG00000124813;ENSG00000138829;ENSG00000185920","RSPO4;PRRX1;RUNX2;FBN2;PTCH1"
"234","GO:0048745","smooth muscle tissue development","The process whose specific outcome is the progression of smooth muscle over time, from its formation to the mature structure.","9.52% (2/21)",0.0020009,2.7,"ENSG00000168542;ENSG00000185920","COL3A1;PTCH1"
"235","GO:0048812","neuron projection morphogenesis","The process in which the anatomical structures of a neuron projection are generated and organized. A neuron projection is any process extending from a neural cell, such as axons or dendrites.","2.14% (14/654)",8.799631e-09,8.06,"ENSG00000044524;ENSG00000129682;ENSG00000140937;ENSG00000144619;ENSG00000153707;ENSG00000169306;ENSG00000169554;ENSG00000169855;ENSG00000174469;ENSG00000179915;ENSG00000184347;ENSG00000185008;ENSG00000185920;ENSG00000198947","EPHA3;FGF13;CDH11;CNTN4;PTPRD;IL1RAPL1;ZEB2;ROBO1;CNTNAP2;NRXN1;SLIT3;ROBO2;PTCH1;DMD"
"236","GO:0048856","anatomical structure development","The biological process whose specific outcome is the progression of an anatomical structure from an initial condition to its mature state. This process begins with the formation of the structure and ends with the mature structure, whatever form that may be including its natural destruction. An anatomical structure is any biological entity that occupies space and is distinguished from its surroundings. Anatomical structures can be macroscopic such as a carpel, or microscopic such as an acrosome.","0.66% (36/5458)",4.62491e-08,7.33,"ENSG00000038427;ENSG00000044524;ENSG00000048052;ENSG00000101282;ENSG00000112562;ENSG00000116132;ENSG00000119042;ENSG00000124813;ENSG00000129682;ENSG00000134532;ENSG00000138735;ENSG00000138829;ENSG00000139174;ENSG00000140937;ENSG00000144619;ENSG00000153707;ENSG00000154162;ENSG00000154654;ENSG00000164741;ENSG00000166250;ENSG00000168542;ENSG00000169306;ENSG00000169554;ENSG00000169855;ENSG00000172260;ENSG00000174469;ENSG00000179915;ENSG00000184304;ENSG00000184347;ENSG00000185008;ENSG00000185532;ENSG00000185565;ENSG00000185737;ENSG00000185920;ENSG00000189337;ENSG00000198947","VCAN;EPHA3;HDAC9;RSPO4;SMOC2;PRRX1;SATB2;RUNX2;FGF13;SOX5;PDE5A;FBN2;PRICKLE1;CDH11;CNTN4;PTPRD;CDH12;NCAM2;DLC1;CLMP;COL3A1;IL1RAPL1;ZEB2;ROBO1;NEGR1;CNTNAP2;NRXN1;PRKD1;SLIT3;ROBO2;PRKG1;LSAMP;NRG3;PTCH1;KAZN;DMD"
"237","GO:0048858","cell projection morphogenesis","The process in which the anatomical structures of a cell projection are generated and organized.","2.08% (14/672)",1.242078e-08,7.91,"ENSG00000044524;ENSG00000129682;ENSG00000140937;ENSG00000144619;ENSG00000153707;ENSG00000169306;ENSG00000169554;ENSG00000169855;ENSG00000174469;ENSG00000179915;ENSG00000184347;ENSG00000185008;ENSG00000185920;ENSG00000198947","EPHA3;FGF13;CDH11;CNTN4;PTPRD;IL1RAPL1;ZEB2;ROBO1;CNTNAP2;NRXN1;SLIT3;ROBO2;PTCH1;DMD"
"238","GO:0048863","stem cell differentiation","The process in which a relatively unspecialized cell acquires specialized features of a stem cell. A stem cell is a cell that retains the ability to divide and proliferate throughout life to provide progenitor cells that can differentiate into specialized cells.","1.57% (4/254)",0.008531883,2.07,"ENSG00000124813;ENSG00000134532;ENSG00000139174;ENSG00000169554","RUNX2;SOX5;PRICKLE1;ZEB2"
"239","GO:0048869","cellular developmental process","A biological process whose specific outcome is the progression of a cell over time from an initial condition to a later condition.","0.8% (32/4016)",7.227183e-09,8.14,"ENSG00000038427;ENSG00000044524;ENSG00000048052;ENSG00000116132;ENSG00000119042;ENSG00000124813;ENSG00000129682;ENSG00000134532;ENSG00000138735;ENSG00000138829;ENSG00000139174;ENSG00000140937;ENSG00000144619;ENSG00000153707;ENSG00000154162;ENSG00000154654;ENSG00000164741;ENSG00000168542;ENSG00000169306;ENSG00000169554;ENSG00000169855;ENSG00000172260;ENSG00000174469;ENSG00000179915;ENSG00000184304;ENSG00000184347;ENSG00000185008;ENSG00000185532;ENSG00000185737;ENSG00000185920;ENSG00000189337;ENSG00000198947","VCAN;EPHA3;HDAC9;PRRX1;SATB2;RUNX2;FGF13;SOX5;PDE5A;FBN2;PRICKLE1;CDH11;CNTN4;PTPRD;CDH12;NCAM2;DLC1;COL3A1;IL1RAPL1;ZEB2;ROBO1;NEGR1;CNTNAP2;NRXN1;PRKD1;SLIT3;ROBO2;PRKG1;NRG3;PTCH1;KAZN;DMD"
"240","GO:0048870","cell motility","Any process involved in the controlled self-propelled movement of a cell that results in translocation of the cell from one place to another.","0.84% (13/1550)",0.000830654,3.08,"ENSG00000038427;ENSG00000044524;ENSG00000048052;ENSG00000112562;ENSG00000119042;ENSG00000129682;ENSG00000164741;ENSG00000168542;ENSG00000169554;ENSG00000169855;ENSG00000184304;ENSG00000185532;ENSG00000185737","VCAN;EPHA3;HDAC9;SMOC2;SATB2;FGF13;DLC1;COL3A1;ZEB2;ROBO1;PRKD1;PRKG1;NRG3"
"241","GO:0050767","regulation of neurogenesis","Any process that modulates the frequency, rate or extent of neurogenesis, the generation of cells in the nervous system.","1.74% (14/806)",1.208455e-07,6.92,"ENSG00000044524;ENSG00000116132;ENSG00000129682;ENSG00000144619;ENSG00000153707;ENSG00000168542;ENSG00000169306;ENSG00000169554;ENSG00000169855;ENSG00000172260;ENSG00000184304;ENSG00000185008;ENSG00000185737;ENSG00000198947","EPHA3;PRRX1;FGF13;CNTN4;PTPRD;COL3A1;IL1RAPL1;ZEB2;ROBO1;NEGR1;PRKD1;ROBO2;NRG3;DMD"
"242","GO:0050768","negative regulation of neurogenesis","Any process that stops, prevents, or reduces the frequency, rate or extent of neurogenesis, the generation of cells within the nervous system.","1.82% (5/275)",0.001747496,2.76,"ENSG00000129682;ENSG00000144619;ENSG00000168542;ENSG00000185737;ENSG00000198947","FGF13;CNTN4;COL3A1;NRG3;DMD"
"243","GO:0050769","positive regulation of neurogenesis","Any process that activates or increases the frequency, rate or extent of neurogenesis, the generation of cells within the nervous system.","1.94% (9/463)",1.287151e-05,4.89,"ENSG00000044524;ENSG00000153707;ENSG00000169306;ENSG00000169554;ENSG00000169855;ENSG00000172260;ENSG00000184304;ENSG00000185008;ENSG00000198947","EPHA3;PTPRD;IL1RAPL1;ZEB2;ROBO1;NEGR1;PRKD1;ROBO2;DMD"
"244","GO:0050770","regulation of axonogenesis","Any process that modulates the frequency, rate or extent of axonogenesis, the generation of an axon, the long process of a neuron.","2.15% (4/186)",0.002845721,2.55,"ENSG00000129682;ENSG00000169554;ENSG00000169855;ENSG00000185008","FGF13;ZEB2;ROBO1;ROBO2"
"245","GO:0050772","positive regulation of axonogenesis","Any process that activates or increases the frequency, rate or extent of axonogenesis.","3.49% (3/86)",0.002567079,2.59,"ENSG00000169554;ENSG00000169855;ENSG00000185008","ZEB2;ROBO1;ROBO2"
"246","GO:0050775","positive regulation of dendrite morphogenesis","Any process that activates or increases the frequency, rate or extent of dendrite morphogenesis.","5.41% (2/37)",0.006143614,2.21,"ENSG00000153707;ENSG00000169306","PTPRD;IL1RAPL1"
"247","GO:0050793","regulation of developmental process","Any process that modulates the frequency, rate or extent of development, the biological process whose specific outcome is the progression of a multicellular organism over time from an initial condition (e.g. a zygote, or a young adult) to a later condition (e.g. a multicellular animal or an aged adult).","0.95% (24/2520)",1.028746e-07,6.99,"ENSG00000044524;ENSG00000048052;ENSG00000112562;ENSG00000116132;ENSG00000124813;ENSG00000129682;ENSG00000134532;ENSG00000138735;ENSG00000138829;ENSG00000139174;ENSG00000144619;ENSG00000153707;ENSG00000164741;ENSG00000168542;ENSG00000169306;ENSG00000169554;ENSG00000169855;ENSG00000172260;ENSG00000179915;ENSG00000184304;ENSG00000185008;ENSG00000185737;ENSG00000185920;ENSG00000198947","EPHA3;HDAC9;SMOC2;PRRX1;RUNX2;FGF13;SOX5;PDE5A;FBN2;PRICKLE1;CNTN4;PTPRD;DLC1;COL3A1;IL1RAPL1;ZEB2;ROBO1;NEGR1;NRXN1;PRKD1;ROBO2;NRG3;PTCH1;DMD"
"248","GO:0050803","regulation of synapse structure or activity","Any process that modulates the physical form or the activity of a synapse, the junction between a neuron and a target (neuron, muscle, or secretory cell).","1.75% (4/229)",0.005956221,2.23,"ENSG00000153707;ENSG00000169306;ENSG00000179915;ENSG00000185008","PTPRD;IL1RAPL1;NRXN1;ROBO2"
"249","GO:0050807","regulation of synapse organization","Any process that modulates the physical form of a synapse, the junction between a neuron and a target (neuron, muscle, or secretory cell).","1.83% (4/218)",0.005010816,2.3,"ENSG00000153707;ENSG00000169306;ENSG00000179915;ENSG00000185008","PTPRD;IL1RAPL1;NRXN1;ROBO2"
"250","GO:0050808","synapse organization","A process that is carried out at the cellular level which results in the assembly, arrangement of constituent parts, or disassembly of a synapse, the junction between a neuron and a target (neuron, muscle, or secretory cell).","1.9% (8/422)",4.942042e-05,4.31,"ENSG00000121440;ENSG00000129682;ENSG00000150672;ENSG00000153707;ENSG00000165995;ENSG00000169306;ENSG00000179915;ENSG00000185008","PDZRN3;FGF13;DLG2;PTPRD;CACNB2;IL1RAPL1;NRXN1;ROBO2"
"251","GO:0050919","negative chemotaxis","The directed movement of a motile cell or organism towards a lower concentration of a chemical.","8.7% (4/46)",1.331632e-05,4.88,"ENSG00000169855;ENSG00000184347;ENSG00000185008;ENSG00000185737","ROBO1;SLIT3;ROBO2;NRG3"
"252","GO:0050920","regulation of chemotaxis","Any process that modulates the frequency, rate or extent of the directed movement of a motile cell or organism in response to a specific chemical concentration gradient.","2.01% (4/199)",0.0036259,2.44,"ENSG00000112562;ENSG00000169855;ENSG00000184304;ENSG00000185008","SMOC2;ROBO1;PRKD1;ROBO2"
"253","GO:0051093","negative regulation of developmental process","Any process that stops, prevents or reduces the rate or extent of development, the biological process whose specific outcome is the progression of an organism over time from an initial condition (e.g. a zygote, or a young adult) to a later condition (e.g. a multicellular animal or an aged adult).","0.97% (9/927)",0.002292049,2.64,"ENSG00000129682;ENSG00000139174;ENSG00000144619;ENSG00000168542;ENSG00000169855;ENSG00000185008;ENSG00000185737;ENSG00000185920;ENSG00000198947","FGF13;PRICKLE1;CNTN4;COL3A1;ROBO1;ROBO2;NRG3;PTCH1;DMD"
"254","GO:0051094","positive regulation of developmental process","Any process that activates or increases the rate or extent of development, the biological process whose specific outcome is the progression of an organism over time from an initial condition (e.g. a zygote, or a young adult) to a later condition (e.g. a multicellular animal or an aged adult).","1.28% (17/1329)",3.141225e-07,6.5,"ENSG00000044524;ENSG00000048052;ENSG00000112562;ENSG00000124813;ENSG00000134532;ENSG00000138735;ENSG00000138829;ENSG00000153707;ENSG00000169306;ENSG00000169554;ENSG00000169855;ENSG00000172260;ENSG00000179915;ENSG00000184304;ENSG00000185008;ENSG00000185920;ENSG00000198947","EPHA3;HDAC9;SMOC2;RUNX2;SOX5;PDE5A;FBN2;PTPRD;IL1RAPL1;ZEB2;ROBO1;NEGR1;NRXN1;PRKD1;ROBO2;PTCH1;DMD"
"255","GO:0051128","regulation of cellular component organization","Any process that modulates the frequency, rate or extent of a process involved in the formation, arrangement of constituent parts, or disassembly of cell structures, including the plasma membrane and any external encapsulating structures such as the cell wall and cell envelope.","0.6% (15/2485)",0.008236462,2.08,"ENSG00000044524;ENSG00000116132;ENSG00000129682;ENSG00000153707;ENSG00000164741;ENSG00000169306;ENSG00000169554;ENSG00000169855;ENSG00000172260;ENSG00000179915;ENSG00000184304;ENSG00000184347;ENSG00000185008;ENSG00000185737;ENSG00000198947","EPHA3;PRRX1;FGF13;PTPRD;DLC1;IL1RAPL1;ZEB2;ROBO1;NEGR1;NRXN1;PRKD1;SLIT3;ROBO2;NRG3;DMD"
"256","GO:0051130","positive regulation of cellular component organization","Any process that activates or increases the frequency, rate or extent of a process involved in the formation, arrangement of constituent parts, or disassembly of cell structures, including the plasma membrane and any external encapsulating structures such as the cell wall and cell envelope.","0.81% (10/1241)",0.004965678,2.3,"ENSG00000044524;ENSG00000153707;ENSG00000169306;ENSG00000169554;ENSG00000169855;ENSG00000172260;ENSG00000179915;ENSG00000184304;ENSG00000185008;ENSG00000198947","EPHA3;PTPRD;IL1RAPL1;ZEB2;ROBO1;NEGR1;NRXN1;PRKD1;ROBO2;DMD"
"257","GO:0051216","cartilage development","The process whose specific outcome is the progression of a cartilage element over time, from its formation to the mature structure. Cartilage elements are skeletal elements that consist of connective tissue dominated by extracellular matrix containing collagen type II and large amounts of proteoglycan, particularly chondroitin sulfate.","2.12% (4/189)",0.003014376,2.52,"ENSG00000116132;ENSG00000119042;ENSG00000124813;ENSG00000134532","PRRX1;SATB2;RUNX2;SOX5"
"258","GO:0051239","regulation of multicellular organismal process","Any process that modulates the frequency, rate or extent of a multicellular organismal process, the processes pertinent to the function of a multicellular organism above the cellular level; includes the integrated processes of tissues and organs.","0.82% (25/3062)",9.864162e-07,6.01,"ENSG00000044524;ENSG00000048052;ENSG00000112562;ENSG00000116132;ENSG00000124813;ENSG00000129682;ENSG00000134532;ENSG00000138735;ENSG00000138829;ENSG00000139174;ENSG00000144619;ENSG00000153707;ENSG00000165995;ENSG00000168542;ENSG00000169306;ENSG00000169554;ENSG00000169855;ENSG00000172260;ENSG00000179915;ENSG00000184304;ENSG00000185008;ENSG00000185532;ENSG00000185737;ENSG00000185920;ENSG00000198947","EPHA3;HDAC9;SMOC2;PRRX1;RUNX2;FGF13;SOX5;PDE5A;FBN2;PRICKLE1;CNTN4;PTPRD;CACNB2;COL3A1;IL1RAPL1;ZEB2;ROBO1;NEGR1;NRXN1;PRKD1;ROBO2;PRKG1;NRG3;PTCH1;DMD"
"259","GO:0051240","positive regulation of multicellular organismal process","Any process that activates or increases the frequency, rate or extent of an organismal process, any of the processes pertinent to the function of an organism above the cellular level; includes the integrated processes of tissues and organs.","0.96% (16/1675)",3.461055e-05,4.46,"ENSG00000044524;ENSG00000048052;ENSG00000112562;ENSG00000124813;ENSG00000134532;ENSG00000138735;ENSG00000138829;ENSG00000153707;ENSG00000169306;ENSG00000169554;ENSG00000169855;ENSG00000172260;ENSG00000179915;ENSG00000184304;ENSG00000185008;ENSG00000198947","EPHA3;HDAC9;SMOC2;RUNX2;SOX5;PDE5A;FBN2;PTPRD;IL1RAPL1;ZEB2;ROBO1;NEGR1;NRXN1;PRKD1;ROBO2;DMD"
"260","GO:0051241","negative regulation of multicellular organismal process","Any process that stops, prevents, or reduces the frequency, rate or extent of an organismal process, the processes pertinent to the function of an organism above the cellular level; includes the integrated processes of tissues and organs.","1.03% (12/1170)",0.0002253999,3.65,"ENSG00000048052;ENSG00000129682;ENSG00000138735;ENSG00000139174;ENSG00000144619;ENSG00000168542;ENSG00000169855;ENSG00000185008;ENSG00000185532;ENSG00000185737;ENSG00000185920;ENSG00000198947","HDAC9;FGF13;PDE5A;PRICKLE1;CNTN4;COL3A1;ROBO1;ROBO2;PRKG1;NRG3;PTCH1;DMD"
"261","GO:0051270","regulation of cellular component movement","Any process that modulates the frequency, rate or extent of the movement of a cellular component.","0.9% (9/1002)",0.003867865,2.41,"ENSG00000048052;ENSG00000112562;ENSG00000129682;ENSG00000164741;ENSG00000168542;ENSG00000169855;ENSG00000184304;ENSG00000185532;ENSG00000185737","HDAC9;SMOC2;FGF13;DLC1;COL3A1;ROBO1;PRKD1;PRKG1;NRG3"
"262","GO:0051271","negative regulation of cellular component movement","Any process that stops, prevents, or reduces the frequency, rate or extent of the movement of a cellular component.","1.58% (5/317)",0.003236135,2.49,"ENSG00000164741;ENSG00000168542;ENSG00000169855;ENSG00000185532;ENSG00000185737","DLC1;COL3A1;ROBO1;PRKG1;NRG3"
"263","GO:0051347","positive regulation of transferase activity","Any process that activates or increases the frequency, rate or extent of transferase activity, the catalysis of the transfer of a group, e.g. a methyl group, glycosyl group, acyl group, phosphorus-containing, or other groups, from a donor compound to an acceptor.","1.19% (8/671)",0.001140999,2.94,"ENSG00000044524;ENSG00000129682;ENSG00000138735;ENSG00000169554;ENSG00000169855;ENSG00000179915;ENSG00000184304;ENSG00000185737","EPHA3;FGF13;PDE5A;ZEB2;ROBO1;NRXN1;PRKD1;NRG3"
"264","GO:0051674","localization of cell","Any process in which a cell is transported to, and/or maintained in, a specific location.","0.84% (13/1550)",0.000830654,3.08,"ENSG00000038427;ENSG00000044524;ENSG00000048052;ENSG00000112562;ENSG00000119042;ENSG00000129682;ENSG00000164741;ENSG00000168542;ENSG00000169554;ENSG00000169855;ENSG00000184304;ENSG00000185532;ENSG00000185737","VCAN;EPHA3;HDAC9;SMOC2;SATB2;FGF13;DLC1;COL3A1;ZEB2;ROBO1;PRKD1;PRKG1;NRG3"
"265","GO:0051960","regulation of nervous system development","Any process that modulates the frequency, rate or extent of nervous system development, the origin and formation of nervous tissue.","1.64% (15/912)",7.752415e-08,7.11,"ENSG00000044524;ENSG00000116132;ENSG00000129682;ENSG00000144619;ENSG00000153707;ENSG00000168542;ENSG00000169306;ENSG00000169554;ENSG00000169855;ENSG00000172260;ENSG00000179915;ENSG00000184304;ENSG00000185008;ENSG00000185737;ENSG00000198947","EPHA3;PRRX1;FGF13;CNTN4;PTPRD;COL3A1;IL1RAPL1;ZEB2;ROBO1;NEGR1;NRXN1;PRKD1;ROBO2;NRG3;DMD"
"266","GO:0051961","negative regulation of nervous system development","Any process that stops, prevents, or reduces the frequency, rate or extent of nervous system development, the origin and formation of nervous tissue.","2.01% (6/299)",0.0003502753,3.46,"ENSG00000129682;ENSG00000144619;ENSG00000168542;ENSG00000185008;ENSG00000185737;ENSG00000198947","FGF13;CNTN4;COL3A1;ROBO2;NRG3;DMD"
"267","GO:0051962","positive regulation of nervous system development","Any process that activates, maintains or increases the frequency, rate or extent of nervous system development, the origin and formation of nervous tissue.","1.91% (10/524)",4.65058e-06,5.33,"ENSG00000044524;ENSG00000153707;ENSG00000169306;ENSG00000169554;ENSG00000169855;ENSG00000172260;ENSG00000179915;ENSG00000184304;ENSG00000185008;ENSG00000198947","EPHA3;PTPRD;IL1RAPL1;ZEB2;ROBO1;NEGR1;NRXN1;PRKD1;ROBO2;DMD"
"268","GO:0051963","regulation of synapse assembly","Any process that modulates the frequency, rate or extent of synapse assembly, the aggregation, arrangement and bonding together of a set of components to form a synapse.","3.88% (4/103)",0.0003159518,3.5,"ENSG00000153707;ENSG00000169306;ENSG00000179915;ENSG00000185008","PTPRD;IL1RAPL1;NRXN1;ROBO2"
"269","GO:0051965","positive regulation of synapse assembly","Any process that activates, maintains or increases the frequency, rate or extent of synapse assembly, the aggregation, arrangement and bonding together of a set of components to form a synapse.","4.84% (3/62)",0.00100066,3,"ENSG00000153707;ENSG00000169306;ENSG00000179915","PTPRD;IL1RAPL1;NRXN1"
"270","GO:0055057","neuroblast division","The process resulting in the physical partitioning and separation of a neuroblast into daughter cells. A neuroblast is any cell that will divide and give rise to a neuron.","13.33% (2/15)",0.001012695,2.99,"ENSG00000129682;ENSG00000134532","FGF13;SOX5"
"271","GO:0055059","asymmetric neuroblast division","The process resulting in the physical partitioning and separation of a neuroblast into two daughter cells with different developmental potentials.","33.33% (2/6)",0.0001473391,3.83,"ENSG00000129682;ENSG00000134532","FGF13;SOX5"
"272","GO:0055117","regulation of cardiac muscle contraction","Any process that modulates the frequency, rate or extent of cardiac muscle contraction.","4.11% (3/73)",0.001605832,2.79,"ENSG00000129682;ENSG00000138735;ENSG00000198947","FGF13;PDE5A;DMD"
